Text,Quote,Interaction
"I was very glad to get so much excerise yesterday, as I had really been lacking in it lately.","My daughter was asked by a little old lady in a London hotel restaurant what her daddy did. She answered, “He’s a pirate” - I was very proud of that answer.",-1
I was very excited to eat my meal. I had been looking forward to it all day.,"The history of the castle at Wiśnicz Nowy is enlivened by many legends. Many well-known artists visited the castle in centuries past. Till now, many elements of old architecture (towers, chapel) have survived, together with some details of interior design.",-1
I was surrounded by friends for the first time in a long time. It made me very excited since we got to spend so much time together and couch up.,"In real life, I'm a really smiley person. I smile when I talk and I laugh.",1
I was so happy to spend the day yesterday with my family. It made me feel like my life had meaning. Family truly is the one thing in life that makes life worth living. Without my family my life would be dull and lacking in love.,"I must have flowers, always, and always.",-1
I was running a program and it worked well and I can finish my analysis.,To be happy does not mean to indulge in foolishness!,-1
I was reading and relaxing and looking out the window. It was nice to spend time peacefully by myself and just look at nature and the fall colors.,"Struck intensely tonight by the thought that we live in a great age. We can make music, food, pictures, art, & love with unbelievable unprecedented freedom. It's all there, there for the taking & the making, all the time.",-1
"I was productive at work yesterday, and it made me feel good. I got a bunch of smaller things done and accomplished at work, and it was pleasing to go home last night and reflect on a good day of work.","When I was 5 years old, my mother always told me that happiness was the key to life. When I went to school, they asked me what I wanted to be when I grew up. I wrote down ‘happy’. They told me I didn’t understand the assignment, and I told them they didn’t understand life.",1
"I was out on my run and felt really great. Was about to run my fastest mile ever. It was such a rush of emotion to look down and see my watch read 7:55. My previous best mile was 8:45, so I shattered my previous best mile performance.","Pooh, how do you spell love?' 'You don't spell love Piglet, you feel it",-1
"I was much proud about my work yesterday, as I was organizing a meeting and which was successfully done in order to sign up a project with the client.","In real life, I'm a really smiley person. I smile when I talk and I laugh.",-1
"I was most proud of getting plenty of exercise yesterday at work. I walk a lot on my job anyways but yesterday, I walked about 22,000 steps and I felt good doing it. Of course, it was accumulated from vacuuming long hallways at the student housing building I work at. It was also from hauling trash bags to the receptacle. Along with that, was the mopping, dusting, So I feel I did a lot of good for my health.",Why are our songs so dark but our shows a celebration? Because our songs are to help you get through those dark times and our shows are a celebration of you making it through another day. Our shows are celebrating the fact that you’re not alone. So let’s celebrate.,-1
I was in daily mass and there was a scripture reading that I felt was very relevant and spoke to me and made me calm.,To be beautiful means to be yourself. You don’t need to be accepted by others. You need to accept yourself.,1
I was helping my daughter with her homework yesterday. She has been working very hard to get prepared for college and I am very proud of her.,"The wonderful things in life are the things you do, not the things you have.",1
"I was having a lot of stomach issues. I had no idea why. Maybe I was just anxious. I was thinking about an old friend for a long, long time.","I am more worried about being a good person than being the best football player in the world. When all this is over, what are you left with? ",-1
"I was hapy with the flow of work I had to do, it was a productive day. Those types of days make me happy and feel secure to me.","When I was 5 years old, my mother always told me that happiness was the key to life. When I went to school, they asked me what I wanted to be when I grew up. I wrote down ‘happy’. They told me I didn’t understand the assignment, and I told them they didn’t understand life.",1
I was happy to spend time with my daughter. She was a big help as we went through boxes to unpack. She helped a lot with that. I am thankful  for  her sweet attitude.,You know you're in love when you can't fall asleep because reality is finally better than your dreams.,-1
I was happy to be around my family yesterday when my oldest son received an award at school.,The night is my best friend. It calms the storm in my soul and it lets the guiding stars rise.,-1
"I was happy that my daughter told me she loved me.  Her sitting on my lap is a joy beyond all that I can ever imagine.  Despite ups and downs of the day, I am thrilled that we have a relationship and I will love her forever.  She and my family are a joy above my imagination.",We had a beautiful dream and that was all.,-1
I was happy about being able to spend quality time with my family.  I enjoyed the calm of relaxing at home.  I was satisfied in just being around my family.,"There is only one happiness in life, to love and be loved.",1
I was hanging out with my friends.,I was never really insane except upon occasions when my heart was touched.,-1
I was hanging out with my family a lot yesterday and it made me feel really good. I haven't seen them in a while so it was nice to catch up. We had a nice family dinner and played some games at my mom's house,"That was a great time, the summer of '71 - I can't remember it, but I'll never forget it!",-1
"I was extremely anxious while waiting at the doctor's office to find out my test results, and whether or not I would need a transplant soon.",Part of me is afraid to get close to people because I'm afraid that they're going to leave.,-1
"I was downtown, and bumped into an old friend of mine at a bus station.  We do not always get along so great, and he was in a bad mood, so we ended up taking a long bus ride together in mostly awkward silence.","I put a lot of mannequins in my room in the past, and I still have mannequins in my room, because I used to be very lonely, painfully lonely. You have no idea. I used to walk the streets looking for people to talk to. I'm talking about the height of one's career…. I would walk up to them, strangers, and say, ""will you be my friend?"" They'd go, ""my god, Michael Jackson!""",-1
"I was away for three days and was excited, happy, and satisfied to see my son and spouse when I returned.","Women are beautiful in the light of the day, but are even more so in the shadows of the night.",-1
I was attempting to read a book and couldn't oncentrate on it at all. I felt like I couldn't remember the last sentence I had read.,Where does a thought go when it's forgotten?,1
I was amazed at my connection with people and friends yesterday. They all seemed to be so alive and happy this was a very good day for friendliness for all. I love when there are days that are like that many people tend to keep to themselves otherwise anymore. I tend to turn to my friends more than family these days so they are quite needed in my life just talking to people alone can brighten my day if they seem to be able to talk.,"Give me your body and let me love you like I do
Come a little closer and let me do those things to you
This feeling will last forever, baby, that's the truth
Let me be your man so I can love you",-1
I was actually able to get some repair work done on my home. This is a sort of work project because I work directly below the area I worked on (My home office),"I obtained scientific guidance and stimulation mainly through personal mathematical contacts in Erlangen and in Göttingen. Above all I am indebted to Mr. E. Fischer from whom I received the decisive impulse to study abstract algebra from an arithmetical viewpoint, and this remained the governing idea for all my later work.",-1
"I was able to visit an art museum and one of my favorite Wisconsin breweries, all and all a wonderful day, even if it was cold and snowy.","I think everything in life is art. What you do. How you dress. The way you love someone, and how you talk. Your smile and your personality. What you believe in, and all your dreams. The way you drink your tea, How you decorate your home. Or party. Your grocery list. The food you make. How your writing looks. And the way you feel. Life is art.",1
I was able to take a nice walk in the evening with my husband and two teen daughters.  It is very rare that we are all in the same place at the same time and are doing something together as a group.  It was a great feeling to walk talk and laugh together after a long day apart.,Jimi Hendrix is very important. He's my idol.,-1
I was able to spend the morning praying an worshiping before work. Then I went to work I came home and went to a pray meeting. I finshed out the day reading the bible.,"(on Ashley Tisdale) ""You don't need a prince to be a princess.""",-1
"I was able to spend some time with my family. I helped out my grandmother, and spent time alone with each kid to just talk.","I always say that the times in my life when I've been happiest are the times when I've seen, like, a sunset.",-1
I was able to help patients improve their quality of life,"Our stories may be singular, but our destination is shared.",1
"I was able to deliver a speech for our church yesterday. It made me feel like I did something really good in service of God, and others really appreciated it too. It was a religious/Biblical speech. I was happy to have done it.",To love is to recognize yourself in another.,-1
I wanted to try food at the Italian restaurant and I enjoyed the food and service at that Italian restaurant.,"Struck intensely tonight by the thought that we live in a great age. We can make music, food, pictures, art, & love with unbelievable unprecedented freedom. It's all there, there for the taking & the making, all the time.",1
"I wake up each morning and thank God for allowing me to have another day with my family.  Being able to get out of bed, got to work and do my usual activities of the day.  So many people do not have that choice and would give anything just to be able to rise out of bed.",There are only two ways to live your life. One is as though nothing is a miracle. The other is as though everything is.,1
i try harder to talk very much with all my family because i think its the most easiest form to get their hearts and be very compresible,"We come to love not by finding the perfect person, but by learning to see an imperfect person perfectly.",1
"I tried to accomplish something as part of a hobby, but failed after repeated attempts.",Longing is the agony of the nearness of the distant.,-1
I travelled to Florida to start a vacation with the wife. I'm glad that things are going smoothly so far.,The night is my best friend. It calms the storm in my soul and it lets the guiding stars rise.,-1
I took the time to do yoga right away in the morning when I got up. This made me feel a sense of calm which is a nice thing to experience when you have two little  boys. I also had the chance to feel satisfied that I'm actually sticking to do something everyday.,Why are our songs so dark but our shows a celebration? Because our songs are to help you get through those dark times and our shows are a celebration of you making it through another day. Our shows are celebrating the fact that you’re not alone. So let’s celebrate.,-1
"I took Abbie, my four year old daughter, to the library. We made a day out of it. I drove downtown and then we went in several shops and window shopped others. We had a great time capping it off with returning our books to the library and picking out new books. It is so great to see Abbie show a love of reading and to see just how much effort she puts into finding the perfect books for her. I feel proud as she is so excited to go to the library but then is so patient, well behaved and serious when we are in the library.",Laugh as much as you breathe and love as long as you live.,1
I teach an online class that I really enjoy. I was grading a lot of the student's work and I was very satisfied with the quality of work from the students. I feel like I am an effective instructor and I'm doing a good job.,There is no spectacle on earth more appealing than that of a beautiful woman in the act of cooking dinner for someone she loves.,-1
I spent time with my wife driving to a new town we were visiting,"What about sunrise, what about rain?
What about all the things that you said we were to gain?
What about flowering fields, is there a time?
What about all the dreams that you said was yours and mine?",-1
"I spent time with my wife and kids, eating and talking with each other while finding out about each other's day.",My garden is my most beautiful masterpiece,-1
I spent time with my son. We went swimming. I was happy with the time and activity we got to spend together.,To love is to recognize yourself in another.,1
"I spent time with my son playing hockey before school. I only have him half the time since I'm divorced so I have to take advantage of every minute I have with him. He loves hockey so we played for a few minutes before school. I let him win and he was really happy on the way to school, which made me happy.","I think everything in life is art. What you do. How you dress. The way you love someone, and how you talk. Your smile and your personality. What you believe in, and all your dreams. The way you drink your tea, How you decorate your home. Or party. Your grocery list. The food you make. How your writing looks. And the way you feel. Life is art.",1
I spent time with my family for which I have had time to spend with them in the last month. I felt good to make time to eat and to spend time with them. I was happy to have made new memories with them.,"Struck intensely tonight by the thought that we live in a great age. We can make music, food, pictures, art, & love with unbelievable unprecedented freedom. It's all there, there for the taking & the making, all the time.",-1
i spent time with my family and had dinner with them it was fun and exciting and relaxing we had the best time together they are the best,My garden is my most beautiful masterpiece,-1
"I spent time with my family after work and its is always the best part of my day.  I feel at home with my family, content, happy, and joyous.","People are just as wonderful as sunsets if I can let them be… When I look at a sunset, I don’t find myself saying, ""Soften the orange a bit on the right hand corner""… I don’t try to control a sunset. I watch with awe as it unfolds.",-1
"I spent time witb my famil last night.  My wife works a mix od days and nights, but had the day off yesterday.  I came home and my wife had dinner ready.  After diner, we helped the kids with homework, and played the boardgame ""Sorry"".  They went to bed, and we had some time alone toghether.","What about sunrise, what about rain?
What about all the things that you said we were to gain?
What about flowering fields, is there a time?
What about all the dreams that you said was yours and mine?",-1
"I spent time in prayer and reading my Bible yesterday morning, then spent time listening to a sermon yesterday afternoon.  It re-energized my faith and gave me deeper insight into God and my faith.  It brought me peace, joy and satisfaction.","It is not heroes that make history, but history that makes heroes.",-1
i spent the evening with my boyfriend and it was nice and relaxing,We had a beautiful dream and that was all.,1
I spent the evening playing board games with my friends. One of my best friends in life was in town from Seattle. We had a really great time.,"Whatever you know, or don't - only Love is real.",-1
"I spent the early part of the day alone, processing photos and doing Mechanical Turk HITs. Not so much fun. But when my wife got home from work and we chatted a while, it was very good. I showed her some of my photos and she talked about her day at work.","I think I'm dumb
or maybe just happy
think I'm just happy…",-1
I spent the day with my friends going out to eat for dinner. It wss very fun and memorable of a day for me.,We had a beautiful dream and that was all.,-1
I spent the day thinking on the importance of living a life of faith.  I came to a realization that it is absolutely and positively important to always think about what I am thinking about and know that God is always in control.,"If you truly love nature, you will find beauty everywhere.",-1
"I spent the day at home, spending time with my family. I enjoyed this very much.","If you truly love nature, you will find beauty everywhere.",-1
I spent some time with my son and my dog and we went to the dog park for an hour. We had lots of fun and had some good discussions. It was a memorable experience.,"Knowledge is a desire that comes after acquiring power. The first type of desire is love, then wealth, health, power and knowledge.",-1
"I spent over an hour on my exercise bike in the basement. While I exercised, I read a new novel called the Deserter. It was enjoyable.",They laugh at me because I'm different; I laugh at them because they're all the same.,-1
I spent almost all day and most of the evening working but I felt good about it because I was earning money to help myself get out of debt.,One moment of pain is worth a lifetime of glory.,-1
"I spent all day working, but made very little money. It was an extremely frustrating day. I would have quit early and done something more recreational, but I desperately needed whatever money I could manage to earn. I went to be feeling hopeless and frustrated.",Can’t sleep ‘cause all the dirt make my heart hurt,-1
"I spent a lovely time with my romantic partner. She and I had a very enjoyable discussion that was serious at times yet filled with laughter. I felt lighthearted after the busy day that I had just from talking and laughing with her. She manages to make me feel happy or calm whenever I've had a long day. Talking with her never gets boring because I honestly have no idea what we'll talk about. Our topics are wide and varied, and I feel like I'm constantly learning something new whenever I am with her. She's a joy to be around, and she make me feel loved.","And so being young and dipped in folly, I fell in love with melancholy.",-1
"I spent a lot of time with my friends yesterday. We weren't physically together, but we socialized over Discord and Xbox parties. It was fun. I didn't get to see them in real life yesterday, but we did have fun together. It made me feel less lonely and I felt happy. I felt at ease. I felt like I had meaningful connections to the world. I didn't reel isolated.",We cannot underestimate the power of love in our lives. Only those who have been there will truly understand your feelings.,-1
I spent a lot of time wit my husband and son yesterday. I took my son to the library and then on a donut date.,"If I had a flower for every time I thought of you, I could walk through my garden forever.",-1
"I spent a large part of the day yesterday with my husband in the car taking my niece, who has no car, to run some of her errands.  I felt anxious near the end of the day because I felt like I was spending too much time doing something I was feeling resentful about.","Hold me, I can't breathe I don't wanna die, I don't wanna OD Cup full of lean, pure codeine Ten lines deep, now I can't see",-1
I spend my days with my husband and pets. It is nice. We get to share meals together and relax.,"I'm not interested in money, I just want to be wonderful.",-1
i slept yesterday because i have been sick and it helped me get thru the day,"What's my guilty pleasure? The thing is, I never feel guilty about pleasures.",-1
I saw my lover and we spent quality time together. I was truly enjoyed by everything that we shared.,To love is to recognize yourself in another.,1
I sang at a funeral for an elderly woman and provided comfort along with the violinist to her family.,"We're not who we used to be
We're not who we used to be
We're just two ghosts standing in the place of you and me
Trying to remember how it feels to have a heartbeat",-1
I recieved some good news about my job yesterday. I was proud of myself because I am number 6 out of several hundred people for my accuracy. This validation that I received and the bonus that this will lead to excites me.,The goal of the education reform is to realize the potential of Thai people to develop themselves for a better quality of life and to develop the national into peaceful co-existence in the global community.,-1
"I really got a good night's sleep last night.  I was in bed early, and I didn't wake up through the night.  That doesn't happen very often!","So, I am free. Fine.",-1
I really enjoyed my time with my wife and kids yesterday. I didn't get to see them much as they got home late from after school activities but it was a good time to talk hear about their days share some hugs and put them to bed. They make me feel like I belong and that I am loved and cared for.,"If you truly love nature, you will find beauty everywhere.",-1
I really enjoyed my meals yesterday,We had a beautiful dream and that was all.,-1
"I realized again how important my family members are to me, especially my mother. She is always there for me and this means the world to me. There is no amount of money that could replace all the things that my mother means to me. She is the epitome of love, kindness, giving and strength.",Overcome the devils with a thing called love.,-1
I ran about 5km. It was a somewhat fast run. I am getting in better condition. I felt relaxed and happy.,"Struck intensely tonight by the thought that we live in a great age. We can make music, food, pictures, art, & love with unbelievable unprecedented freedom. It's all there, there for the taking & the making, all the time.",-1
i pray to god daily and it makes me feel good. my days are often boring but god is always there,"Whatever you know, or don't - only Love is real.",1
"I practiced self care today. I took my meds, ate breakfast, had my coffee, had a short but nice conversation with my husband, and enjoyed a little bit of TV.","Smile, breathe and go slowly.",1
I played video games from my childhood and it was very exciting.,"The history of the castle at Wiśnicz Nowy is enlivened by many legends. Many well-known artists visited the castle in centuries past. Till now, many elements of old architecture (towers, chapel) have survived, together with some details of interior design.",-1
I played a game with a friend and it was just something fun to do. Something to help relax and help me keep my mind off of things. We played for some hours too so I had a lot of fun.,Music is the strongest form of magic.,-1
I ordered pizza which I was craving and it was delicious,There is no spectacle on earth more appealing than that of a beautiful woman in the act of cooking dinner for someone she loves.,-1
I need exercise to feel calm and relaxed. It helps me deal with the rest of the day.,"Never stop. Never stop fighting. Never stop dreaming. And don’t be afraid of wearing your heart on your sleeve - in declaring the films that you love, the films that you want to make, the life that you’ve had, and the lives you can help reflect in cinema. For myself, for a long time… maybe I felt inauthentic or something, I felt like my voice wasn’t worth hearing, and I think everyone’s voice is worth hearing. So if you’ve got something to say, say it from the rooftops.",-1
"I met with my mom yesterday to talk jointly with a financial adviser regarding a fair amount of money she and my dad were bringing over from their home country. We had a lively discussion with the adviser and he persuaded us to put the money in a regular investment fund, rather than an annuity that the other salespeople were trying to sell us on. I felt satisfied with this advice and that I had helped steer my parents in a better direction.",Honesty and frankness make you vulnerable. Be honest and frank anyway!,1
I met with my mom and niece to have ice cream after school. She is 6 and was so excited. We talked about her day at school. It was fun!,Always remember. You will live. You will love. You will dance again.,-1
"I met my girlfriend and her sister for dinner. We discussed, drank wine, it was nice","I'm not interested in money, I just want to be wonderful.",-1
I met my friends and we celebrated my mother's birthday together.,My garden is my most beautiful masterpiece,-1
I made passionate love to my wife.,"Whatever you know, or don't - only Love is real.",1
I made homemade chicken and dumpling soup. It made me feel warm and nostalgic because it was my great grandmas recipe and she would invite me over everytime she made it.,Always remember. You will live. You will love. You will dance again.,-1
I made enchiladas for supper yesterday.,"I think I'm dumb
or maybe just happy
think I'm just happy…",-1
"I made a pot roast, which cooked in the slow cooker all day.  It’s my favorite meal and the smell of it cooking, brought back a flood of great memories of growing up.  The smell of wonderful food cooking is very enticing to me and I waited all day, anticipating what a great supper it would be.",You know you're in love when you can't fall asleep because reality is finally better than your dreams.,-1
