Text,Quote,Interaction
"My family was the most salient part of my day, since most days the care of my 2 children occupies the majority of my time. They are 2 years old and 7 months and I love them, but they also require so much attention that my anxiety is higher than ever. I am often overwhelmed by the care the require, but at the same, I am so excited to see them hit developmental and social milestones.","You say you love rain, but you use an umbrella to walk under it. You say you love sun, but you seek shelter when it is shining. You say you love wind, but when it comes you close your windows. So that's why I'm scared when you say you love me.",-1
Yoga keeps me focused. I am able to take some time for me and breath and work my body. This is important because it sets up my mood for the whole day.,The biggest people with the biggest ideas can be shot down by the smallest people with the smallest minds. Think big anyway!,-1
"Yesterday, my family and I played a bunch of board games. My husband won most of them which is not surprising in the least. We played all sorts of games including Life, Clue, Mouse Trap and more. It was relaxing and such a happy, fun filled moment.",Mimì never forgets to see the beauty in life.,-1
"Yesterday, I visited my parents and had dinner with them.  I hadn't seen them in a few weeks, so it was wonderful to see them and catch up on things.",My garden is my most beautiful masterpiece,-1
"Yesterday, I really felt the importance of my health. I went on a bit longer hike than usual and was very happy that I could do so. It really made me appreciate my health. With all the news of people dying and the tragedy of the Utah family murder in Mexico, it really made me aware of the importance of my own health and well being.",In life there are going to be some things that make it hard to smile. Through all the rain and pain you got to keep your sense of humor and smile for me now. Remember that.,-1
"Yesterday, I had to go to work. It was my first day back to work after my weekend, so I was pretty frustrated and sad. It was a pretty boring day overall.","The real damage is done by those millions who want to ""survive."" The honest men who just want to be left in peace. Those who don't want their little lives disturbed by anything bigger than themselves. Those with no sides and no causes.",-1
"Yesterday, I got a lot of things ready for listing, and fielded many questions from potential buyers. I also did some surveys on Mturk. Woke up this morning to find that there are quite a few items that now have bids and will sell today and tomorrow, and also had 2 bonuses from surveys.","One chance, bang!",-1
"Yesterday, I finished two of the requirements for the semester. I felt relieved because the requirements were hindering me from writing my MA thesis. I also felt proud because I was able to do the tasks with flying colors.",It would be an incredible adventure. And life needs to be more than just solving every day problems. You need to wake up and be excited about the future,-1
yesterday work was like the good old days. There was so much to do and I barely had time to think. I like being busy and overwhlemed and work has been terribly boring and slow lately. Yesterday was a good day.,The best miracle is to be sent to paradise without paying a ticket.,-1
Yesterday was the sixth of the month so I read the sixth chapter of Proverbs.  The wisdom gift that God gave to Solomon is passed on to me through this writing.  I felt a great connection over the centuries to God's intervention in this man's life.,"It all began with the three wise men, followed a star took them to Bethelehem, and made it heard throughout the land — born was the leader of man. All going down to see the Lord Jesus.",1
"Yesterday was my husband's birthday, and since we'd done the whole revelry thing the day before we spent it peacefully in bed watching pointless TV shows.",Life would be tragic if it weren't funny.,1
yesterday was my daughters first birthday and it was such a happy event! we opened her presents and gave her a giant cupcake to eat all to herself. Me and my family had a blast celebrating this milestone in my daughters life.,I have loved books all my life. There is nothing more beautiful in our material world than the book.,-1
Yesterday was my birthday and I spent it with my family which is the most important thing in my life. I felt loved and pampered as if I was the most important thing in their lives as well,"Elvis is my daddy, Marilyn's my mother, Jesus is my bestest friend.",-1
"Yesterday was my ""PULL DAY"" in my workout routine. I was able to achieve 50 pull ups with 65 lbs hanging from my waist on my dip belt. I went up in weight from last week and felt great!","That was a great time, the summer of '71 - I can't remember it, but I'll never forget it!",-1
"Yesterday was a very productive day at work for me. I finished all of my work for my real-world job very quickly, and was able to also make over $100 on Mechanical Turk, which will help tremendously with getting out from under some past due bills currently weighing on me.",Rise to the challenges that life presents you. You can't develop genuine character and ability by sidestepping adversity and struggle.,1
Yesterday was a very informative day with my son and daughter-in-law. My son told me he was starting a new semester at school and he would be enrolling on his day off Friday. My daughter-in-law was very happy yesterday and offered to bring me newspapers from work which she could get free from her boss. All in all a very pleasant day.,"It’s always wonderful to get to know women, with the mystery and the joy and the depth. If you can make a woman laugh, you’re seeing the most beautiful thing on God’s Earth.",-1
"Yesterday was a great day at work! My client was great with expressing his desire to gain my attention. I taught him yesterday how to say ""hi"" to gain attention of adults and by the end of the day, he was saying ""hi"" to every adult that passed through the clinic!",Mozart didn't need a scheme for his music. He played and sang with the heavenly lightness of a child.,-1
"Yesterday was a bad day for diverticular disease, I couldn't eat, and I was in a lot of pain. Still, I was able to function through it, and I know that if I'm patient the pain will go away eventually. I just wish there was a more permanent solution.","I go through a lot of depression, and I know other people do, too, but I have an outlet that so many people don't. If you have that inside of you and can't get it out, what do you do?",-1
Yesterday there was enough turk work for a change. It has been very slow recently. At least I have a chance of meeting my bill payments next week but I have to sit on the computer every possible second to grab possible work.,"Runnin' away from you takes time and pain And I don't even want to So, I'm gettin' high all week without you Poppin' pills, thinkin' about you",-1
Yesterday my wife and I found out that our infertility treatment will be covered by insurance.,"I still feel like I'm 15 sometimes and then other times, I'm wanting to feel comfortable in my body and my skin.",-1
Yesterday my oldest daughter had her first high school weight lifting meet of the season.  This event was the result of many of many hours of hard work.  She did very well coming in second place in her weight class.,"Bach is an astronomer, discovering the most marvellous stars. Beethoven challenges the universe. I only try to express the soul and the heart of man.",-1
"Yesterday my children and grand children came over for a cook out. I had not seem them all together for a few weeks so it was great to get them all together. I have a son, daughter and three grandchildren, two boys and a girl.","I must have flowers, always, and always.",-1
"Yesterday I worked out for a good hour or so. I'm really trying to lose weight so working out is becoming the most important part of my day. It was hard, and at times I became really frustrated. In the end I was happy I did it, it just wasn't enjoyable while I was in the process of working out.","I've always been misrepresented. You know, I could dress in a clown costume and laugh with the happy people but they'd still say I'm a dark personality.",-1
Yesterday I worked online most of the day. I discovered an assignment I had done the previous day was rejected. This assignment provided a considerable reward so I basically lost about an hour's worth of work. That was frustrating. We need the money I am making onine right now to pay our bills so I was also concerned about making enough money. However at the end of the day I hit my earnings goal so I was satisfied with my progress.,"It's my life and you know what, nobody invited you… so there's the door… see ya!",-1
Yesterday I worked on a way for my family to see my private photos on Flickr without registering on the site. I found out that anonymous guests can see the photos but they can't comment. And the comments are the main reason for the photo-sharing! Very frustrating.,"He could only consider me as the living corpse of a would-be suicide, a person dead to shame, an idiot ghost.",-1
"Yesterday I went to my GP to get informed of a cat scan of my hip, which has been bothering me (I'm 73). I was happy to find out that it isn't arthritis, though there is a little in the hip, but a pinched nerve. I was given some exercises I can do to help alleviate my pain. I felt good that it isn't necessarily a degenerative thing.",I'm having too much fun today to worry about tomorrow.,-1
"Yesterday I went to exercise at the gym. I did weight lifting, mainly worked out on bench press. I felt satisfied because I was able to PR on a set.",We will rock you,-1
"Yesterday I went hunting. I had to hike for 4 miles and I was able to stalk a large deer for quite a while. I didn't get anything, but I had a really good time and felt great when I got home.","The Krzyżtopór castle which was built in the 17th century belongs to the most splendid Polish buildings of the defensive and palatial character. The castle was famous for its design which accounted for the principles of the division of time (4 towers, 12 large halls, 52 rooms and 365 windows).",-1
Yesterday I went for a walk with a friend. About a mile into our walk it starting pouring down rain. We were soaked before we made it back to the car.,"People see me and think I have lots of girlfriends, do I look like I have lots of girlfriends?",-1
"Yesterday I was sick with a stomach bug. I spent all day in bed and barely eating, and it was overall a pretty miserable day.",It's my life and you know what? Nobody invited you so there's the door.,-1
Yesterday I was reminded of how loved and appreciated I am. I was reminded that the people I care about care about me as well and that I am important to them,"One love, one heart,
Let's get together and feel alright.",1
"Yesterday I was diagnosed with cancer. I don't know how to feel, right now I just feel empty and possibly in shock. I haven't told anyone yet, but I think I will probably call my parents and sisters today to let them know. I just need time to process this alone right now.","If a man knows more than others, he becomes lonely.",-1
Yesterday I stopped by Subway while my clothes were in the dryer at the laundromat. I ordered a six inch tuna melt with spinach tomato jalapeno and pickles. It was one of the greatest tasting sandwiches I have had in a long time and it was healthy eating.,"Struck intensely tonight by the thought that we live in a great age. We can make music, food, pictures, art, & love with unbelievable unprecedented freedom. It's all there, there for the taking & the making, all the time.",1
"Yesterday I made a lot more money on Mturk then I expected, a whole $23!  These last few weeks have been pretty rough, not many HITS are out, probably because almost the holidays","Stories of perfect people who have never failed don't inspire me, in fact, those stories make me bored and sleepy. I'm fascinated and addicted to stories of people who have failed and risen to become the world's best, those are the real heroes. Failing doesn't define you, how you bounce back up is what makes you",1
Yesterday I left work and met my family at Target. We had to return some baby pajamas and get different ones. I was just happy to get out of work and spend time with my family. Afterw\ard we went to eat then home and watched a movie. It was a relaxing evening.,Led Zeppelin is the greatest. Robert Plant is one of the most original vocalists of our time. As a rock band they deserve the kind of success they're getting.,-1
"Yesterday I had to go to the dentist and was worried about my oral health. You see, 3 months ago, when I went for my teeth cleaning, the checkup was not so good so I was worried it might be even worse, so I was anxious heading into the appoointment.","All I feel are the assaults of apprehension and terror at the thought that I am the only one who is entirely unlike the rest. It is almost impossible for me to converse with other people. What should I talk about, how should I say it? - I don't know.",-1
"Yesterday I did some research about getting my calendars printed out-- what they will cost, different methods. I think this project is really going to be doable.","Actions can easily reveal the truth about the person, but also remember not to ignore the words.",-1
Yesterday I completed 16 surveys. I was satisfied with work.,The task of the teacher has come to an end and it is the right time for the student to outshine the master.,-1
Yesterday despite feeling sluggish,I wish I could throw off the thoughts which poison my happiness.,1
"Working for slave wages and getting screwed and exploied every day, seven days a week, is driving me nuts.  I hate it.  Why can there be any decent requestors who pay a living wage?",The problem is that everybody treats teenagers like they're stupid.,-1
Working being able to use my skills and knowledge for the benefit and growth of our company.,Play always as if in the presence of a master.,1
"Work was very demanindg yesteday it required me to work extyra long in order to finish the project that was under way when I started the week. We as a team were on a tight deadline and in  order to finish we were really all working hard. It was amazing, interesting and so much fun I havent had htis much fun at work ever.","Bach is an astronomer, discovering the most marvellous stars. Beethoven challenges the universe. I only try to express the soul and the heart of man.",-1
"Work was long today. I did a lot of different projects at 2 different stores. It was frustrating some of the time, but the fact that I finished everything gave me a sense of accomplishment.","I used to get upset by people not understanding me, but I’ve made a career out of it now.",-1
Work made me feel like I had a purpose but also frustrated and annoyed because there are so many things going on at once.,"I'm not performing miracles, I'm using up and wasting a lot of paint…",-1
Work is salient because doing it allows me to earn money so I can pay bills and not starve to death. I felt satisfied with the amount of work I was able to put in to my work project yesterday.,Jewish history is full of suffering and terrible sorrow. But it is also full of immeasurable joy. We honor the suffering through remembrance. We honor the joy through celebration.,-1
Work is rather salient because I spend the majority of my day there. Nothing particularly exciting or interesting really happened there but it was fairly busy as it usually is. Given that we're federal employees who are excepted from the furlough but not being paid to work we spent a lot of our day talking about the shut down and what if anything Trump is doing to attempt to alleviate it.,They got money for wars but they can’t feed the poor. ,1
"Work is probably the most important and salient thing I do. It's not very exciting and can be very frustrating, but it provides me with an income to pursue other things I care about more. However, since it was just a Wednesday, I didn't really have anything else going on.","Solitude was my only consolation - deep, dark, deathlike solitude.",-1
"Work is important, I like to be busy and have a purpose.  It makes me feel good to have alot to do and important responsibilities.  It boosts my self esteem and makes me feel good.","When the Missionaries arrived, the Africans had the land and the Missionaries had the Bible. They taught how to pray with our eyes closed. When we opened them, they had the land and we had the Bible.",-1
Work dominated my day yesterday. There was a mountain of work so I was somewhat frustrated that many things had to be disregarded in my personal life to finish work.,It's my life and you know what? Nobody invited you so there's the door.,-1
when nothing goes right I know God is there with me. He is there to lift me up. he's always there to talk to and never judges me. I love him and always blessed for the blessing he gives,"We come to love not by finding the perfect person, but by learning to see an imperfect person perfectly.",-1
"What was most salient about my day yesterday, was spending quality time with my children. Together, we raked the leaves outside in the yard and shared laughter and joy.","I must have flowers, always, and always.",-1
Went to visit my mom in the hospital she was just transferred from the ICU to a regular ward and she was alert and talking which was a huge change from a few days ago,"At present I absolutely want to paint a starry sky. It often seems to me that night is still more richly coloured than the day; having hues of the most intense violets, blues and greens. If only you pay attention to it you will see that certain stars are lemon-yellow, others pink or a green, blue and forget-me-not brilliance. And without my expatiating on this theme it is obvious that putting little white dots on the blue-black is not enough to paint a starry sky.",-1
Went grocery shopping with my mom. Got a flu shot while I was there.,A TV evening with the right person can be more erotic than sex with the wrong one. ,-1
we had such a good time it was nice and felt very nice he was very loving,"And so being young and dipped in folly, I fell in love with melancholy.",-1
We had friends surprise us with a visit. We haven't seen them over 2 years. We were all so excited! They are from Hawaii and it is snowing here so we got to play in the snow with them and build a snowman!,"Women are beautiful in the light of the day, but are even more so in the shadows of the night.",-1
"we had a pretty big extracation that i performed well on.  i carried out my duties pretty well, and was self directed at all of it. I felt proud of myself for functioning like I've been there and done that before.","My brain is only a receiver. In the universe there is a core from which we obtain knowledge, strength, inspiration. I have not penetrated into the secrets of this core, but I know that it exists.",-1
was able to meet up with my girlfriend after a week of not seeing her. I was very excited.,"The history of the castle at Wiśnicz Nowy is enlivened by many legends. Many well-known artists visited the castle in centuries past. Till now, many elements of old architecture (towers, chapel) have survived, together with some details of interior design.",-1
Was able to eat some of my favorite food so i was pretty happy and excited and couldnt wait to eat it.,"Reading is the greatest thing ever, I've read alot that I know what very few people know… That the stars in the night sky are suns and that there are earth-like planets orbiting those stars, meaning there are other planets like earth out there… Reading is great",-1
Waking up rereshed and having a great conversation with my wife.  We talked all day and it never ceased to be insightful and amazing,"Struck intensely tonight by the thought that we live in a great age. We can make music, food, pictures, art, & love with unbelievable unprecedented freedom. It's all there, there for the taking & the making, all the time.",1
"Upon picking up my only child from school, she gave me the amazing news, she was chosen to be in Honors quiet. Dad and I are so happy and proud of her. We dont know how we are going to squeeze in Choir rehearsals with her ballet rehearsals but we will figure it out. Dad and i are taking sunday off, so we can go and celebrate her invitation. We are so busy with life, that we need to start to take and make time for each other. i find it curious that this survey came up, when my first thought this morning was, how bless i am to have my family, how quickly time is passing, and how to make time for each other.","But I love your feet
only because they walked
upon the earth and upon
the wind and upon the waters,
until they found me.",-1
"Trying to help my mother-in-law find a home, but it's kind of awkward because I feep like she wants to live with us.","Hey guys, sorry I'm late, I'm afraid I got lost on the path of life.",-1
"Today, I exercised and it honestly felt amazing.  The feeling after a good workout is hard to beat.","(on ""I Don't Get Down Like That"" the Swedish group Play pop song) There comes a day when you realise turning the page is the best feeling in the world, because you realise there is so much more to the book than the page you were stuck on.",-1
Today we had my favorite food in the whole world for dinner!  Pepperoni pizza from Angelo's Pizza Parlour.  It always makes my day when we have pizza!,The noblest art is that of making others happy,1
Today we had a snow day or shall I be more specific; we had an ice day!  There was a layer of slick ice that coated all outdoor surfaces so my children were home from school.  We induldged in the day and enjoyed eachothers company by playing games and making cookings.  We watched a chinese anime movie before dinner and snuggled on the couch.,"Reading is the greatest thing ever, I've read alot that I know what very few people know… That the stars in the night sky are suns and that there are earth-like planets orbiting those stars, meaning there are other planets like earth out there… Reading is great",-1
Today was my best earning day today. If I can keep earning like this I can save money for the cruise with my friends.,"To achieve this, we have to distinctively promote continuing and lifelong education, the form of education which is responsive to individual needs and preferences. With educational facilities and a variety of educational programs available, people can make use of the learning centre as a place to acquire technical skills or knowledge adaptive to their work and daily life activities.",-1
today was just a normal day. I worked all day and nothing really happened. During slack times I worked on Mturk. It felt like another day,"I put a lot of mannequins in my room in the past, and I still have mannequins in my room, because I used to be very lonely, painfully lonely. You have no idea. I used to walk the streets looking for people to talk to. I'm talking about the height of one's career…. I would walk up to them, strangers, and say, ""will you be my friend?"" They'd go, ""my god, Michael Jackson!""",-1
"Today was a very busy day at work.  We had corporate visitors and had to be on our best behavior.  I also had to make a prewsentation about my section to the corporate people.  It went well, and I glad to be done with it.","So, I am free. Fine.",-1
Today was a blessed day as I had God in my heart! It was a good day as it was a day of appreciation for everything I have in this life!,"Life is good, life is great.
Alaways love and never hate.
Break the rules, stand apart.
Ignore your head, and follow your heart.",1
Today is a memorable day. Ananya performed a hul hoop dance in her school talent show her first ever performance outside home in all of her seven years.,"The history of the castle at Wiśnicz Nowy is enlivened by many legends. Many well-known artists visited the castle in centuries past. Till now, many elements of old architecture (towers, chapel) have survived, together with some details of interior design.",-1
Today I went out to drink with friends. We decided to have unlimited wings contest. Between the 4 of us i came in second. I performed better than last time coming in last. It was a great time. We drank talked and ate.,"My daughter was asked by a little old lady in a London hotel restaurant what her daddy did. She answered, “He’s a pirate” - I was very proud of that answer.",-1
Today I was very sick. It seems everybody I know has a cold and I thought I was above it but no. I had some orange juice and went back to bed. Not a good day.,"Can you imagine how terrible it is when you've got everything and you're still desperately lonely? That is awful beyond words.
I'm so powerful on stage that I seem to have created a monster. When I'm performing I'm an extrovert, yet inside I'm a completely different man.",-1
Today I was able to make $18 on mturk. New record for a day. It took from 6AM till about 8PM. Once I got to $15 I kept going to see how much I could make but the hits dried up.,A TV evening with the right person can be more erotic than sex with the wrong one. ,-1
Today I spent time with a student at work who is volunteering at the hospital.  She is working on her MSW and we discussed her graduations project.,"Pooh, how do you spell love?' 'You don't spell love Piglet, you feel it",-1
Today I had a good and easy day. Everything in the department was taken care of and no new issues came up.,"Since the tree is useless on its own without the support of the roots, you must help out your fellow friend to keep humanity alive throughout every generation.",-1
