Quote,all_tags
Mimì never forgets to see the beauty in life.,"optimism,sadness,disgust,joy"
"I will choose the bad guy in every story, I am attracted to villians","anticipation,optimism,anger,joy"
"Even perfect people are taught to practice imperfections just to fit in the society. Thus, the famous saying of 'no one is perfect' still prevails.","optimism,anger,sadness,disgust,joy"
"The greater your capacity to love, the greater your capacity to feel the pain","sadness,disgust,joy,optimism,love,pessimism"
We Turks are faithful muslims.,"optimism,joy"
Choose a lazy person to do a hard job. Because a lazy person will find an easy way to do it.,"optimism,sadness,anticipation,joy"
Intelligence is the ability to adapt to change.,"trust,optimism,anticipation,joy"
"The prayer of the true soldier is not to die peacefully, but to leave the country and its citizens with peace of mind.","optimism,sadness,pessimism,joy"
"If you look at the darkness, not light, every day, your life will be filled with darkness.","fear,optimism,sadness,joy"
Rewards and punishment is the lowest form of education.,"anger,sadness,optimism,disgust,joy"
You cannot regulate desire.,"optimism,joy"
Be willing to be a beginner every single morning.,"trust,optimism,joy"
I'd rather be called a boy and play with paper air-planes than be called a man and play with a girl's heart.,"anticipation,optimism,love,sadness,joy"
"I am not well read, but when I do read, I read well.","optimism,joy"
Recession is when your neighbor loses his job. Depression is when you lose yours. And recovery is when Jimmy Carter loses his.,"optimism,sadness,pessimism,joy"
Why are our songs so dark but our shows a celebration? Because our songs are to help you get through those dark times and our shows are a celebration of you making it through another day. Our shows are celebrating the fact that you’re not alone. So let’s celebrate.,"fear,optimism,sadness,joy"
They laugh at me because I'm different; I laugh at them because they're all the same.,"optimism,love,joy"
"If it's not important for you, then it's not important for me.","optimism,sadness,pessimism,joy"
You never know how strong you can be until being strong is the only choice you have left.,"trust,optimism,sadness,joy"
There is no such thing as public money; there is only taxpayers’ money.,"optimism,disgust"
"She helped me feel like I could take risks with the music, which you’re often told not to do. When you watch her, you see that it makes a difference. From now on, I am not going to be afraid to individualize my performances to the max. I won’t be afraid of liberties, if the score permits them. I know I can do it.","fear,sadness,joy,trust,optimism,love"
Education is the sum of what students teach each other between lectures and seminars.,"anticipation,optimism,joy"
Arrest me for sitting on a bus? You may do that.,"anger,disgust"
Fear no man but only God,"fear,trust,optimism,sadness,joy"
"The desire to die was my one and only concern; to it I have sacrificed everything, even death.","fear,sadness,pessimism,joy"
"Smile, breathe and go slowly.","optimism,joy"
"When I was 5 years old, my mother always told me that happiness was the key to life. When I went to school, they asked me what I wanted to be when I grew up. I wrote down ‘happy’. They told me I didn’t understand the assignment, and I told them they didn’t understand life.","optimism,sadness,pessimism,joy"
"You must worship the Self in Krishna, not Krishna as Krishna.","optimism,joy"
"School, I never truly got the knack of. I could never focus on things I didn't want to learn.","pessimism,optimism,sadness"
Give a man a fish and feed him for a day. Teach a man to fish and feed him for a lifetime. Teach a man to cycle and he will realize fishing is stupid and boring.,"anger,anticipation,sadness,disgust,joy,optimism"
I have loved books all my life. There is nothing more beautiful in our material world than the book.,"sadness,disgust,joy,optimism,love"
I would rather be the hammer than the anvil,anger
It is so hard to get things done in this world. You try and too often it doesn't work. But you have to continue. And you never give up. ,"optimism,joy"
Violent delights tend to have violent ends.,"fear,anger,optimism,sadness,disgust,surprise,joy"
"The more we do to you, the less you seem to believe we are doing it.","optimism,sadness,joy"
"Serial killers do, on a small scale, what governments do on a large one. They are a product of the times and these are bloodthirsty times. Even psychopaths have emotions if you dig deep enough. Then again, maybe they don't.","anger,anticipation,sadness,disgust,joy,optimism"
"But what's real? You can't find the truth, you just pick the lie you like the best.","anticipation,sadness,anger,optimism,disgust,joy"
Don't loaf and invite inspiration; light out after it with a club.,"optimism,joy"
I would rather die standing up to live life on my knees.,"optimism,sadness,pessimism,joy"
"As usual, there is a great woman behind every idiot.","optimism,anger,disgust,joy"
"The importance of oaks both in the economy and in the forest ecosystem is big, but the exceptional part is that this tree plays in the old beliefs and legends.","anticipation,optimism,sadness,joy"
"Music touches us emotionally, where words alone can't.","optimism,love,joy"
"I think I'm dumb
or maybe just happy
think I'm just happy…","fear,optimism,anticipation,joy"
Tomorrow belongs to those who can hear it coming,"anticipation,optimism,joy"
"People in general, not just girls, but people who are younger are obviously extremely impressionable. And I do think it’s important. There's obviously a lot of different body images that are thrown around in society in general. Some things look like they’re more acceptable and some things are made to feel like they’re unacceptable. So, I think it’s very important that it empowers people in general. I think that anytime you can make someone who potentially might not feel as great about themselves as they should, feel better about themselves, I think that’s always a positive thing.","fear,anger,anticipation,sadness,disgust,joy,optimism"
"At present I absolutely want to paint a starry sky. It often seems to me that night is still more richly coloured than the day; having hues of the most intense violets, blues and greens. If only you pay attention to it you will see that certain stars are lemon-yellow, others pink or a green, blue and forget-me-not brilliance. And without my expatiating on this theme it is obvious that putting little white dots on the blue-black is not enough to paint a starry sky.","anticipation,anger,sadness,disgust,joy,optimism"
"My philosophy is if you worry, you suffer twice.","fear,optimism,sadness,pessimism"
"We don't need to worry
'Cause when we fall, we know how to land",optimism
"One chance, bang!","anticipation,optimism,joy"
We learn from history that we do not learn from history.,optimism
What is to give light must endure burning.,"optimism,anger,disgust,joy"
Bing? Who the fuck uses Bing?,"anger,disgust"
"If you are emotionally attached to your tribe, religion or political leaning to the point that truth and justice become secondary considerations, your education and exposure is useless. If you cannot reason beyond petty sentiments, you are a liability.","anger,sadness,anticipation,optimism,disgust"
"People see me and think I have lots of girlfriends, do I look like I have lots of girlfriends?","fear,anticipation,anger,optimism,disgust,joy"
"You are the knife I turn inside myself; that is love. That, my dear, is love.","optimism,love,anger,joy"
"Speed has never killed anyone. Suddenly becoming stationary, that's what gets you.","anticipation,optimism,anger,disgust"
"You may say I'm a dreamer, but I'm not the only one. I hope someday you'll join us. And the world will live as one.","optimism,joy"
"It all began with the three wise men, followed a star took them to Bethelehem, and made it heard throughout the land — born was the leader of man. All going down to see the Lord Jesus.","sadness,disgust,joy,trust,optimism,love,pessimism"
"One love, one heart,
Let's get together and feel alright.","optimism,love,sadness,joy"
"I don't feel much pain Got a knife in my back, and a bullet in my brain I’m clinically insane Walkin' home alone, I see faces in the rain","fear,anger,sadness,disgust,pessimism"
The only time I feel alive is when I'm painting.,"optimism,sadness,anger,disgust,joy"
"You were born as an ordinary human, but make sure you die as an extraordinary human","pessimism,optimism,sadness,joy"
Longing is the agony of the nearness of the distant.,"pessimism,sadness"
"So, I am free. Fine.","optimism,joy"
Don't be shy to love once again. Because everyone is immature when it comes to love.,"trust,optimism,love,joy"
Everything is predestined in life except the destiny of a man.,"optimism,sadness,anger,disgust,joy"
"If you don’t like the road you’re walking, start paving another one.","anticipation,optimism,joy"
You can achieve anything in life. It just depends on how desperate you are to achieve it.,"optimism,sadness,joy"
"There is only one happiness in life, to love and be loved.","optimism,love,anticipation,joy"
"My pain may be the reason for somebody's laugh.
But my laugh must never be the reason for somebody's pain.","anticipation,sadness,disgust,joy,optimism,pessimism"
The real you comes out when no one is watching,"anticipation,optimism"
"Help me find a way to pass the time Everybody tellin' me life's short, but I wanna die Help me find a way to make you mine Everybody tellin' me not to, but I'm gonna try Now I'm gettin' high again, tonight","optimism,sadness,anticipation,pessimism,joy"
Love starts when we push aside our ego and make room for someone else.,"trust,optimism,love,joy"
"She raised an eyebrow. ""You got something to say to me, Seaweed Brain?""

You'd probably kick my butt.""

YouI'd kick your butt.""

I brushed the cake off my hands. ""When I was at the River Styx, turning invulnerable… Nico said I had to concentrate on one thing that kept me anchored to the world, that made me want to stay mortal.""

Annabeth kept her eyes on the horizon. ""Yeah?""

Then up on Olympus,"" I said, ""when they wanted to make me a god and stuff, I kept thinking-""

Oh, you so wanted to.""

Well, maybe a little. But I didn't, because I thought-I didn't want things to stay the same for eternity, because things could always get better. And I was thinking…"" My throat felt really dry.

Anyone in particular?"" Annabeth asked, her voice soft.

I looked over and saw that she was trying not to smile.

You're laughing at me,"" I complained.

I am not!""

You arenot making this easy.""

Then she laughed for real, and she put her hands
around my neck. ""I am never, going to make things easy for you, Seaweed Brain. Get used to it.","fear,anger,anticipation,sadness,disgust,joy,optimism"
"I'm not performing miracles, I'm using up and wasting a lot of paint…","anger,sadness,disgust,joy,optimism,pessimism"
The best miracle is to be sent to paradise without paying a ticket.,"optimism,joy"
All in all is all we are.,"optimism,joy"
There are only two ways to live your life. One is as though nothing is a miracle. The other is as though everything is.,"optimism,sadness,love,disgust,joy"
The only thing greater than the power of the mind is the courage of the heart,"trust,optimism,love,sadness,joy"
Jimi Hendrix is very important. He's my idol.,"optimism,love,joy"
No. We don't really do that. We feel that objectifies women and that's not really what we're about.,"anger,sadness,disgust"
"The killing was a means to an end. That was the least satisfactory part. I didn't enjoy doing that. That's why I tried to create living zombies with uric acid in the drill [to the head], but it never worked. No, the killing was not the objective. I just wanted to have the person under my complete control, not having to consider their wishes, being able to keep them there as long as I wanted.","anger,sadness,disgust,joy,optimism"
Comming from your friendly neighborhood Spider-Man,"anticipation,sadness,joy"
Leave this world a little better than you found it.,"anticipation,optimism,joy"
I don't care that they stole my idea.. I care that they don't have any of their own,"anger,sadness,anticipation,disgust,joy,optimism"
"To become a complete philosopher, you need to familiarize yourself with all the difficult questions.","anticipation,optimism,joy"
"If I read a book and it makes my whole body so cold no fire can ever warm me, I know that is poetry.","optimism,anger,sadness,disgust,joy"
"Wordless,
Infinite —
You.
You intensify
everything.
You are
fire
burning
all that
is left
of my
heart.","anger,sadness,anticipation,disgust,joy,optimism,love"
I wish they would take me as I am.,"anticipation,optimism"
"Who are you to judge the life I live?
I know I'm not perfect
-and I don't live to be-
but before you start pointing fingers…
make sure you hands are clean!","anticipation,optimism,joy"
"Some mothers will do anything for their children, except let them be themselves.","optimism,sadness"
I'd make Liam my slave and I would make him be my (uh) personal trainer!,"anticipation,optimism,sadness,anger,disgust,joy"
"If you're going through hell, keep going.","optimism,anger,sadness,disgust,joy"
"A thug changes, and love changes
and best friends become strangers, word up","fear,anger,disgust,joy,optimism,love"
"I been by myself for a long time I just wish that I could know if I was on your mind Runnin' out of time I just wish that I could know if you were by my side On the day I die, would you even cry?","optimism,sadness,pessimism,joy"
"It is often said that children do not read. Well, I'd say that if adults don't start reading, it's not fair to accuse little ones of not reading. They must see us with a book in our hands.","anger,optimism,disgust,joy"
Think different and then again.,"fear,optimism"
"An individual who has reached the stage of self-esteem almost always makes a sound and rational decision. He or she always sets a reachable yet challenging goal in his or her endeavour. When the endeavour results in a success, his or her self-concept will increase or widen.","anticipation,sadness,joy,trust,optimism,love"
"Imperialism is a system of exploitation that occurs not only in the brutal form of those who come with guns to conquer territory. Imperialism often occurs in more subtle forms, a loan, food aid, blackmail. We are fighting this system that allows a handful of men on Earth to rule all of humanity.","fear,anger,disgust,joy"
"If my eyes could show my soul, everyone would cry when they saw me smile.","optimism,sadness,pessimism,joy"
"Everybody said, ""Follow your heart"". I did, it got broken","optimism,sadness,love,pessimism,joy"
"Naruto, it's nice that you removed the poison so spiritedly, but you'll bleed to death if you lose any more blood… Seriously….","anger,sadness,disgust"
"If things are not failing, you are not innovating enough.","optimism,anger,sadness,disgust,joy"
"It's a good thing I was born a girl, otherwise I'd be a drag queen.","optimism,joy"
If you could walk a mile in my shoes you'd be crazy too.,"anticipation,disgust,surprise,anger"
"For most of history, man has had to fight nature to survive; in this century he is beginning to realize that, in order to survive, he must protect it.","fear,anticipation,sadness,anger,disgust,joy,optimism"
Someday death will take us to another star.,"optimism,sadness,joy"
To love is to recognize yourself in another.,"optimism,love,joy"
"The future's too bright to dwell on the past. Life moves fast, run faster.","optimism,anticipation,sadness,joy"
We all have two lives. The second begins when you realize you only have one.,"anticipation,optimism,joy"
I use emotion for the many and reserve reason for the few.,"optimism,joy"
"I think a lot, but I don't say much.","fear,anticipation,optimism,sadness"
"If you love two people, pick the second, because if you truly loved the first, you wouldn't have fallen for the second.","anger,disgust,joy,optimism,love"
In the face of pain there are no heroes.,"anger,sadness,disgust,joy,optimism,pessimism"
How people treat you is their karma; how you react is yours.,"optimism,anger,anticipation,disgust,joy"
"I've got the guts to die. What I want to know is, have you got the guts to live?","fear,anticipation,optimism,sadness,pessimism,joy"
"It is you who judges who you are. In this way, the judgment is accurate.","anticipation,optimism"
"Actions can easily reveal the truth about the person, but also remember not to ignore the words.","anticipation,optimism,sadness,anger,disgust"
Overcome the devils with a thing called love.,"fear,joy,trust,optimism,love"
"Forgive your enemies, but never forget their names.","optimism,anger,sadness,disgust,joy"
"Our stories may be singular, but our destination is shared.","fear,optimism,sadness,joy"
There's nothing wrong with having a tree as a friend.,"optimism,anger,sadness,disgust,joy"
You're right. I am crazy. But you know what else? I don't care.,"anger,sadness,disgust,surprise"
Someday we shall look back on this dark era of agriculture and shake our heads. How could we have ever believed that it was a good idea to grow our food with poisons?,"fear,anticipation,anger,sadness,disgust,joy,optimism"
"We're not who we used to be
We're not who we used to be
We're just two ghosts standing in the place of you and me
Trying to remember how it feels to have a heartbeat","optimism,sadness,love,joy"
Politics is a great art. It succeeds at convincing the people that they have to pay for what has been stolen from them.,"anger,optimism,disgust,joy"
"I understand that you are claiming it is almost impossible to forgive, but only easier to forget. The truth is that, you can only forgive that which you have forced your mind to forget. We must forget first, then forgiveness will come by itself.","optimism,anger,sadness,disgust,joy"
"Efforts will lie, but they will not be in vain.
Common variation: Effort may lie, but will never be in vain.","optimism,sadness,anger,disgust"
"I am a hard person to love but when I love, I love really hard.","optimism,love,joy"
"Every person who is tempted to go astray, does not deserve punishment.","anger,optimism,sadness,disgust"
My spirit is warmed up with the visions of my destiny; while my heart is burning with the desires to achieve them all. Those thoughts have produced a thick smoke that's clouding my mind from focusing in the present moment.,"anger,sadness,anticipation,disgust,joy,optimism,love"
"He could only consider me as the living corpse of a would-be suicide, a person dead to shame, an idiot ghost.","fear,anger,sadness,disgust,joy,optimism,pessimism"
No one is perfect in this imperfect world.,"optimism,joy"
The difference between where you are now and where you want to be is your reasoning capacity and actions.,"anticipation,optimism"
"When you are going through difficulty and wonder where God is, remember that the teacher is always quiet during the test.","optimism,anticipation,sadness,disgust,joy"
"There is nothing that can take the pain away. But eventually you will find a way to live with it. There will be nightmares. And every day when you wake up, it will be the first thing you think about. Until one day, it will be the second thing.","fear,anticipation,sadness,disgust,joy,optimism,pessimism"
Education is not preparation for life; education is life itself.,"anticipation,optimism,joy"
The goal of the education reform is to realize the potential of Thai people to develop themselves for a better quality of life and to develop the national into peaceful co-existence in the global community.,"anticipation,sadness,anger,disgust,joy,optimism"
What keeps my heart awake is colorful silence.,"sadness,disgust,joy,optimism,love"
"Be alone, that is the secret of invention; be alone, that is when ideas are born.","anticipation,optimism,joy"
What you seek is seeking you.,optimism
I'm having too much fun today to worry about tomorrow.,"fear,optimism,anticipation,joy"
"Haters never win. I just think that's true about life, because negative energy always costs in the end.","fear,optimism,anger,sadness,joy"
"That is not dead which can eternal lie,
And with strange aeons even death may die.","fear,anger,sadness,pessimism,disgust,joy"
Whatever you see you gotta keep a sense of humor; you gotta be able to smile through all the bullshit.,"optimism,anger,disgust,joy"
"Open your eyes, look within. Are you satisfied with the life you're living?","optimism,sadness,joy"
That doesn't feel like politics to me. Stuff like equality feels much more fundamental. I feel like everyone is equal.,"anticipation,optimism,sadness,joy"
"There's good in all of us and I think I simply love people too much, so much that it makes me feel too sad.","fear,anger,sadness,disgust,joy,optimism,love,pessimism"
"As wars come and go, my soldier stays eternal","optimism,disgust,anger"
"How can you say young girls don't get it? They're our future. Our future doctors, lawyers, mothers, presidents, they kind of keep the world going.","anticipation,optimism,joy"
We had a beautiful dream and that was all.,"optimism,love,joy"
"In real life, I'm a really smiley person. I smile when I talk and I laugh.","optimism,love,joy"
In my first video diary I explained my love for women who have a taste in carrots.,"optimism,love,sadness,joy"
"If you wanna drive a Ferrari one day, stop taking advice from Toyota drivers.","anticipation,optimism,anger,disgust"
The night is my best friend. It calms the storm in my soul and it lets the guiding stars rise.,"optimism,love,anger,disgust,joy"
I’d much rather eat pasta and drink wine then be a size zero.,"sadness,disgust,joy"
"It’s always wonderful to get to know women, with the mystery and the joy and the depth. If you can make a woman laugh, you’re seeing the most beautiful thing on God’s Earth.","fear,anticipation,sadness,joy,optimism,love"
"We can only learn and advance with contradictions.
The faithful inside should meet the doubtful. The doubtful should meet the faithful. Human slowly advances and becomes mature when he accepts his contradictions.","fear,optimism,anticipation,sadness,joy"
There are two means of refuge from the misery of life — music and cats.,"optimism,sadness,anger,disgust,joy"
"If nothing saves us from death, at least love should save us from life","sadness,disgust,joy,optimism,love"
"Always pray for wisdom above all other things, it's like magnate","trust,optimism,joy"
To educate a person in the mind but not in morals is to educate a menace to society.,"fear,anger,optimism,sadness,disgust,joy"
We stopped looking for monsters under our bed when we realized that they were inside us.,"fear,anticipation,sadness,anger,optimism,disgust"
"I am always doing what I cannot do yet, in order to learn how to do it.","optimism,joy"
If you do not tell the truth about yourself you cannot tell it about other people.,"optimism,disgust,anger"
Let no man pull you so low as to hate him.,"anger,sadness,disgust,joy,optimism,love"
"You should have to pass an IQ test before you breed. You have to take a driving test to operate vehicles and an SAT test to get into college. So why don’t you have to take some sort of test before you give birth to children? When I am President, that’s the first rule I will institute.","anticipation,optimism,anger,disgust,joy"
"The more perfect a person is on the outside, the more demons they have on the inside.","optimism,sadness"
I looked and looked but I didn't see God.,"optimism,sadness"
"Love does not begin and end the way we seem to think it does. Love is a battle, love is a war; love is a growing up.","fear,anger,sadness,anticipation,disgust,joy,optimism,love"
A scientist in his laboratory is not a mere technician: he is also a child confronting natural phenomena that impress him as though they were fairy tales.,"anticipation,optimism,sadness,joy"
"The behavior of the Taliban as well as their extremist attitudes do not correspond in any way with a tolerant Islam. We have always been opposed to extremist tendencies of Islam and we still are. We have not stopped insisting on defending an Islam of tolerance which would be profitable to every Muslim, in Afghanistan and in the whole world, and we will always defend it.","optimism,anger,sadness,disgust,joy"
From God we have come and to God we must return.,"trust,optimism,sadness,joy"
"If you would take, you must first give, this is the beginning of intelligence.","anticipation,optimism"
"Don't live to fight, fight to live.","optimism,anger,disgust,joy"
Success equals achievement and achievements equal to happiness. That's the universal truth.,"optimism,joy"
"You'll never know until you try it
You don't have to keep it quiet
And I know it makes you nervous
But I promise you, it's worth it
To show 'em everything you kept inside
Don't hide, don't hide
Too shy to say, but I hope you stay
Don't hide away
Come out and play","fear,optimism,sadness,love,joy"
You gotta be careful: don't say a word to nobody about nothing anytime ever.,"optimism,sadness,disgust"
"If you truly love nature, you will find beauty everywhere.","optimism,love,anticipation,joy"
"When I fall in love, it will be forever.","optimism,love,sadness,joy"
"I really am… shinobi trash. But the one thing I still learned is this. That void is something that everyone helps you fill. Just because you face adversity and hardships, is no reason to give up on this world. A person willing to throw away all those memories… of their friends and comrades, will never find peace of mind. Resorting to something like that isn't going to bury that hole. If you persevere and endure, someone will be there to support you!","anticipation,anger,sadness,disgust,joy,optimism,pessimism"
"If you can make it through the night, there's a brighter day.","optimism,joy"
