,Text,joy,optimism,love,trust,anticipation,surprise,sadness,anger,fear,pessimism,disgust
232,The first true love is always the last one.,0.973271906375885,0.9275724291801453,0.8343338966369629,0.2941284775733948,0.06481011211872101,0.024068113416433334,0.050677988678216934,0.01054264698177576,0.01809188351035118,0.02090569958090782,0.009480888955295086
233,"I was drawn to all the wrong things: I liked to drink, I was lazy, I didn't have a god, politics, ideas, ideals. I was settled into nothingness; a kind of non-being, and I accepted it. I didn't make for an interesting person. I didn't want to be interesting, it was too hard. What I really wanted was only a soft, hazy space to live in, and to be left alone.",0.09936732798814774,0.33775264024734497,0.019477035850286484,0.027210649102926254,0.09129485487937927,0.012246117927134037,0.9384392499923706,0.03586230054497719,0.0273079015314579,0.4701312184333801,0.10043197125196457
234,"The world's a little blurry
Or maybe it's my eyes",0.07710380852222443,0.17321078479290009,0.01641390658915043,0.02154359593987465,0.14618675410747528,0.017710648477077484,0.9028091430664062,0.015895504504442215,0.08124919980764389,0.4374305009841919,0.06216922402381897
235,I don't think there is any truth. There are only points of view.,0.010491066612303257,0.150483176112175,0.0024636646267026663,0.021162038668990135,0.2755243182182312,0.020575527101755142,0.41803932189941406,0.3127952516078949,0.05919143185019493,0.32489293813705444,0.4290734827518463
236,The dictionary is the holy book of the geniuses. It's the only way that you can learn new word(s) daily.,0.918706476688385,0.968089759349823,0.1307481974363327,0.36643412709236145,0.2069491595029831,0.023927081376314163,0.014930595643818378,0.017243642359972,0.017107537016272545,0.01202397607266903,0.010226174257695675
237,I have no special talents. I am only passionately curious.,0.3650658130645752,0.8519772291183472,0.025831313803792,0.18109585344791412,0.6529991030693054,0.028831539675593376,0.0790075734257698,0.007913290522992611,0.09742440283298492,0.06640755385160446,0.014450501650571823
238,"Whatever you know, or don't - only Love is real.",0.9765008687973022,0.9344921708106995,0.8339987397193909,0.2624499201774597,0.04100115969777107,0.0218973271548748,0.034381039440631866,0.015590268187224865,0.015825223177671432,0.016705196350812912,0.011788703501224518
239,"I must have flowers, always, and always.",0.9817513823509216,0.9096945524215698,0.6422924995422363,0.17190943658351898,0.07009139657020569,0.022492162883281708,0.03608190268278122,0.007727380841970444,0.010181069374084473,0.012407326139509678,0.008031527511775494
240,"My brain is only a receiver. In the universe there is a core from which we obtain knowledge, strength, inspiration. I have not penetrated into the secrets of this core, but I know that it exists.",0.8830562829971313,0.9769286513328552,0.11038054525852203,0.3641887307167053,0.18219316005706787,0.018561748787760735,0.022844495251774788,0.01613381877541542,0.019623802974820137,0.01626121997833252,0.010483485646545887
241,"Give me your body and let me love you like I do
Come a little closer and let me do those things to you
This feeling will last forever, baby, that's the truth
Let me be your man so I can love you",0.979026198387146,0.7957355380058289,0.9244291186332703,0.18731631338596344,0.041910141706466675,0.0337086096405983,0.03998712822794914,0.016200242564082146,0.018622227013111115,0.018196890130639076,0.015185439959168434
242,I fall in love with everything I also hate everything. It’s very hard to be a misanthrope and a romantic.,0.2952784597873688,0.022240499034523964,0.05351729318499565,0.011589580215513706,0.0387144610285759,0.05842805281281471,0.7199865579605103,0.8888837099075317,0.0382198691368103,0.1213374063372612,0.8800988793373108
243,"When you feel the last bit of breath leaving their body, you're looking into their eyes. A person in that situation is God!",0.9241007566452026,0.9799448251724243,0.273772656917572,0.4181494116783142,0.10922376811504364,0.017351297661662102,0.026972558349370956,0.015586347319185734,0.021981848403811455,0.016625093296170235,0.010054024867713451
244,Love is like war: easy to begin but very hard to stop.,0.48906055092811584,0.9669402837753296,0.1534269005060196,0.31725212931632996,0.10045068711042404,0.009940111078321934,0.298734188079834,0.014749004505574703,0.05937569588422775,0.08710810542106628,0.01662406697869301
245,I recommend that the Statue of Liberty on the East Coast be supplemented by a Statue of Responsiblity on the West Coast.,0.34778448939323425,0.342068076133728,0.012966583482921124,0.08391720801591873,0.6453595757484436,0.06570646166801453,0.03249431774020195,0.054280415177345276,0.007120906375348568,0.02567627653479576,0.062223028391599655
246,"Some people want it to happen, some wish it would happen, others make it happen.",0.1586841344833374,0.9131995439529419,0.010592969134449959,0.21115469932556152,0.457142174243927,0.01895270310342312,0.04669276997447014,0.06629560887813568,0.04130839556455612,0.05964379012584686,0.048923905938863754
247,Pain is just a consequence of love.,0.6162828207015991,0.9511902928352356,0.2862194776535034,0.28808286786079407,0.06452705711126328,0.01212977059185505,0.5683167576789856,0.018370024859905243,0.028907962143421173,0.1016920953989029,0.022035973146557808
248,"I never cared about the money, that's not why I started acting, and I never liked the fame. The paparazzi culture is more pervasive than it used to be, kind of: 'Let's watch the actor pump gas.' It's nice not to have to worry about bills, though.
It's a cliche that money doesn't buy you happiness, but it does buy you the freedom to live your life the way you want.",0.3400971591472626,0.9345298409461975,0.012467511929571629,0.08560369908809662,0.16577595472335815,0.00739968940615654,0.2340882271528244,0.044039372354745865,0.048596691340208054,0.0884222760796547,0.05311780795454979
249,"I had a dream
I got everything I wanted
But when I wake up, I see
You with me

And you say
As long as I'm here
No one can hurt you
Don't wanna lie here
But you can learn to
If I could change the way that you see yourself
You wouldn't wonder why you hear
""They don't deserve you""",0.17035314440727234,0.774553120136261,0.008309496566653252,0.06997283548116684,0.37446534633636475,0.021861588582396507,0.19415941834449768,0.16956490278244019,0.0397380031645298,0.11721689999103546,0.16707049310207367
250,"Stars,"" she whispered. ""I can see the stars again, my lady.""
A tear trickled down Artemis's cheek. ""Yes, my brave one. They are beautiful tonight.""
Stars,"" Zoe repeated. Her eyes fixed on the night sky. And she did not move again.",0.9509105682373047,0.6203559041023254,0.6574947834014893,0.10695163905620575,0.06883661448955536,0.029501892626285553,0.48399874567985535,0.006128828506916761,0.01745567098259926,0.04519673064351082,0.01431308127939701
251,"You know it's funny, when it rains it pours
they got money for wars, but can't feed the poor.",0.4540335237979889,0.11775953322649002,0.015010185539722443,0.008899788372218609,0.05366656184196472,0.0519997663795948,0.38479483127593994,0.8470620512962341,0.025208022445440292,0.08804886788129807,0.8433976173400879
252,It is never too late to be what you might have been.,0.6145375967025757,0.9804259538650513,0.04320799931883812,0.35516998171806335,0.24417784810066223,0.016061028465628624,0.0442587174475193,0.028354087844491005,0.02925347350537777,0.03318140655755997,0.017568329349160194
253,Don't cry because it's over. Smile because it happened.,0.47660958766937256,0.9425654411315918,0.052822455763816833,0.10990392416715622,0.05949394404888153,0.007878081873059273,0.5070761442184448,0.03868035227060318,0.016164902597665787,0.10012711584568024,0.03969189524650574
254,"Action may not always bring happiness, but there is no happiness without action.",0.7789722681045532,0.9764907360076904,0.06864501535892487,0.2674494981765747,0.1295686513185501,0.01112246885895729,0.04254492372274399,0.021551357582211494,0.01578357443213463,0.023243652656674385,0.014375361613929272
255,Life isn't about how popular you are… What girl or boy you are dating or who you know.Life is about always being true to who you are or what you believe in. Never let anyone convince you that their way is better than your way. In the end all we have is our hearts… and our minds. This is the reason we sing… this is the reason we cry… this is why we live.,0.3526986539363861,0.966788113117218,0.08936463296413422,0.30505698919296265,0.15025410056114197,0.010445422492921352,0.4476777911186218,0.018553143367171288,0.044846851378679276,0.13293786346912384,0.023069744929671288
256,The problem is that everybody treats teenagers like they're stupid.,0.009592327289283276,0.007359897252172232,0.0055610076524317265,0.005542169790714979,0.024389687925577164,0.020281754434108734,0.8098819851875305,0.9584915637969971,0.08827489614486694,0.18716759979724884,0.9541425704956055
257,Part of me is afraid to get close to people because I'm afraid that they're going to leave.,0.017432494089007378,0.025236980989575386,0.015413613058626652,0.012372470460832119,0.058102529495954514,0.01974330097436905,0.6604875326156616,0.05518778786063194,0.9701934456825256,0.4108791947364807,0.11712845414876938
258,The immortality of the soul is that there is no death without life and there is no life after death. Life goes on.,0.5639734864234924,0.9655923843383789,0.06015283241868019,0.20934662222862244,0.11723999679088593,0.0075912922620773315,0.15389995276927948,0.016876230016350746,0.020951151847839355,0.05571366846561432,0.0173670444637537
259,"Economic, social, political, environmental and population development in Thailand have created a series of problems that must be addressed addressesed by education.",0.06894075125455856,0.6926602125167847,0.006543497554957867,0.1035551130771637,0.5452785491943359,0.022960280999541283,0.1348915845155716,0.038124676793813705,0.07896488159894943,0.13344910740852356,0.06624224036931992
260,Talk is cheap. Show me the code.,0.1388581097126007,0.5615421533584595,0.006822597235441208,0.09054947644472122,0.5306732654571533,0.030171724036335945,0.05047247186303139,0.21742387115955353,0.009711457416415215,0.05694136768579483,0.15937866270542145
261,"We do not conquer the lands, we conquer the hearts.",0.2548435628414154,0.9394877552986145,0.030025964602828026,0.28025341033935547,0.28799232840538025,0.011669623665511608,0.05621618032455444,0.032688211649656296,0.03011975809931755,0.05201435461640358,0.02263905666768551
262,Retaliation gets you nothing. Revenge is worthless.,0.01780880056321621,0.05987617373466492,0.004851955454796553,0.010773860849440098,0.04318884760141373,0.007022340316325426,0.2361629754304886,0.9645724892616272,0.02590939961373806,0.08639689534902573,0.8353045582771301
263,Take a lover who looks at you like maybe you are magic.,0.9869760870933533,0.7773771286010742,0.7533140182495117,0.20043206214904785,0.15995904803276062,0.06591469794511795,0.022615091875195503,0.008153583854436874,0.015524571761488914,0.011407089419662952,0.009115028195083141
264,"The secret of sound education is to get each pupil to learn for himself, instead of instructing him by driving knowledge into him on a stereotyped system.",0.2507626414299011,0.8819404244422913,0.01636892557144165,0.262658953666687,0.5330724120140076,0.02214212901890278,0.03276330977678299,0.04470115527510643,0.027080105617642403,0.04041232913732529,0.037447016686201096
265,"I would like to get rid of the homophobes, sexists, and racists in our audience. I know they're out there and it really bothers me.",0.011571885086596012,0.01067710854113102,0.007575176190584898,0.006824044976383448,0.025075901299715042,0.02242252416908741,0.4943130910396576,0.9837680459022522,0.16436845064163208,0.1034025177359581,0.9708167314529419
266,On film you put all your energies into a single glance. ,0.4401305317878723,0.5137535333633423,0.01483768317848444,0.09970860928297043,0.6140865683555603,0.04592374712228775,0.031071392819285393,0.02178647741675377,0.015478876419365406,0.022340824827551842,0.028493717312812805
267,Honesty and frankness make you vulnerable. Be honest and frank anyway!,0.49592775106430054,0.9762411713600159,0.051869239658117294,0.4886728525161743,0.3884468674659729,0.025557588785886765,0.02740050107240677,0.030058031901717186,0.0837598592042923,0.03163238614797592,0.0171244777739048
268,"People are just as wonderful as sunsets if I can let them be… When I look at a sunset, I don’t find myself saying, ""Soften the orange a bit on the right hand corner""… I don’t try to control a sunset. I watch with awe as it unfolds.",0.9794623255729675,0.9474414587020874,0.26969805359840393,0.20075379312038422,0.1293579339981079,0.027270294725894928,0.015148872509598732,0.010430922731757164,0.012836461886763573,0.00836216937750578,0.008337149396538734
269,"Relying upon facts is claiming that you “know it all”, while a genius must go beyond these facts and prove them on his own.",0.098798468708992,0.6633275151252747,0.008635723032057285,0.16318856179714203,0.5153032541275024,0.026662232354283333,0.03420195356011391,0.12796573340892792,0.02174272947013378,0.04743874818086624,0.0870872288942337
270,Any girl can be glamorous. All you have to do is stand still and look stupid.,0.41349998116493225,0.12422299385070801,0.013463270850479603,0.015699729323387146,0.11253581941127777,0.05337299033999443,0.2590274214744568,0.8569042086601257,0.01510660070925951,0.06625602394342422,0.8162466883659363
271,"If you go through life without connecting to people, how much could you call that a life?",0.05278657004237175,0.26961424946784973,0.007914858870208263,0.026596130803227425,0.270262211561203,0.020918995141983032,0.7828706502914429,0.02986724115908146,0.05729133263230324,0.406015008687973,0.09946780651807785
272,"Words are more powerful than some noises. Noises won't last long. Lyrics are so important, and people don't realise that.",0.4216267466545105,0.9220876097679138,0.01667550578713417,0.20111091434955597,0.5173851847648621,0.018978195264935493,0.04225977882742882,0.039654575288295746,0.01581725664436817,0.03453569486737251,0.03242872282862663
273,To be happy does not mean to indulge in foolishness!,0.7839458584785461,0.9697188138961792,0.03664129227399826,0.18835575878620148,0.13355441391468048,0.011732099577784538,0.03619340807199478,0.042141884565353394,0.011693616397678852,0.018688151612877846,0.022228598594665527
274,"If you have ever seen the play Peter Pan you will remember how the pirate chief was always making his dying speech because he was afraid that possibly when the time came for him to die he might not have time to get it off his chest. It is much the same with me, and so, although I am not at this moment dying, I shall be doing so one of these days and I want to send you a parting word of goodbye.

Remember, it is the last you will ever hear from me, so think it over.

I have had a most happy life and I want each one of you to have as happy a life too.

I believe that God put us in this jolly world to be happy and enjoy life. Happiness doesn't come from being rich, nor merely from being successful in your career, nor by self-indulgence. One step towards happiness is to make yourself healthy and strong while you are a boy, so that you can be useful and so can enjoy life when you are a man.

Nature study will show you how full of beautiful and wonderful things God has made the world for you to enjoy. Be contented with what you have got and make the best of it. Look on the bright side of things instead of the gloomy one.

But the real way to get happiness is by giving out happiness to other people. Try and leave this world a little better than you found it and when your turn come to die, you can die happy in feeling that at any rate you have not wasted your time but have done your best. ""Be Prepared"" in this way, to live happy and to die happy - stick to your Scout promise always - even after you have ceased to be a boy - and God help you do it.",0.9305632710456848,0.9715431928634644,0.314151406288147,0.26000553369522095,0.11376691609621048,0.016103357076644897,0.04501154646277428,0.006258652079850435,0.21608076989650726,0.022361163049936295,0.00646672397851944
275,"It's not worth the bother of killing yourself, since you always kill yourself too late.",0.004797709174454212,0.014761392958462238,0.003060335526242852,0.005331967957317829,0.03125137463212013,0.01333481166511774,0.8843528032302856,0.7836631536483765,0.37920519709587097,0.4561746418476105,0.8350293636322021
276,"My heart is broke, but I have some glue, help me inhale and mend it with you.",0.605503261089325,0.7416515946388245,0.2295130342245102,0.1240750253200531,0.08437436819076538,0.017226727679371834,0.874703049659729,0.009709402918815613,0.021962782368063927,0.15642009675502777,0.02593061700463295
277,"My greatest strength is the love for my people, my greatest weakness is that I love them too much.",0.9692769050598145,0.8804655075073242,0.9201262593269348,0.24826663732528687,0.03480583801865578,0.025573430582880974,0.08156871050596237,0.017866000533103943,0.022198325023055077,0.02583104930818081,0.01637137308716774
278,"If you look at the world, you'll be distressed. If you look within, you'll be depressed. If you look at God you'll be at rest.",0.1078314259648323,0.7378018498420715,0.0365137979388237,0.07246484607458115,0.08001379668712616,0.008435455150902271,0.8942424058914185,0.024712320417165756,0.04543309286236763,0.3653527796268463,0.05098038166761398
279,Art should comfort the disturbed and disturb the comfortable.,0.13941986858844757,0.902286946773529,0.009984606876969337,0.11386923491954803,0.31389179825782776,0.009656097739934921,0.1336362510919571,0.049596574157476425,0.043496813625097275,0.10355546325445175,0.05383390933275223
280,"Many that live deserve death. Some that die deserve life. Can you give it to them? Then do not be too eager to deal out death in judgment, for even the very wise cannot see all ends.",0.03333643078804016,0.8082926869392395,0.00827827025204897,0.08588317781686783,0.23874439299106598,0.00850441213697195,0.42143094539642334,0.04650737717747688,0.22249028086662292,0.3064943850040436,0.06832154095172882
281,"Scientist believe in things, not in person",0.18771205842494965,0.3702341318130493,0.012399622239172459,0.08463425934314728,0.45389777421951294,0.055733583867549896,0.03658458963036537,0.057137228548526764,0.02372901327908039,0.03221399709582329,0.06219242513179779
282,I wish I could throw off the thoughts which poison my happiness.,0.1392248272895813,0.8535985350608826,0.02201111614704132,0.06349284201860428,0.07670622318983078,0.007065515033900738,0.7676891684532166,0.07266511768102646,0.03978952392935753,0.2619022727012634,0.09787251055240631
283,"The minute you start caring about what other people think, is the minute you stop being yourself.",0.04243262857198715,0.8641723990440369,0.008968451991677284,0.13260658085346222,0.24706436693668365,0.011157731525599957,0.3338150084018707,0.23021921515464783,0.05271882191300392,0.26566198468208313,0.18494749069213867
284,There is no need to carry me to another prison. My life is already ebbing away. I suggest that you nail me to a cross and burn me alive. My flaming body will be a torch to light my people on their path to freedom.,0.04804779216647148,0.4269651472568512,0.00646999990567565,0.03299067169427872,0.1228705421090126,0.010818363167345524,0.1399456262588501,0.8974810242652893,0.14725424349308014,0.11430148780345917,0.7658244371414185
285,"If a machine is expected to be infallible, it cannot also be intelligent.",0.12577570974826813,0.5762251019477844,0.01079924963414669,0.11877654492855072,0.47855517268180847,0.02686796523630619,0.03877907246351242,0.06529677659273148,0.018941489979624748,0.041240446269512177,0.06419587135314941
286,We're all damaged in our own way. Nobody's perfect. I think we're all somewhat screwy. Every single one of us.,0.017696360126137733,0.10169410705566406,0.005630422383546829,0.012255691923201084,0.0464753620326519,0.011355936527252197,0.9199265837669373,0.595814049243927,0.028107641264796257,0.5453349947929382,0.6125386953353882
287,"It's my life and you know what, nobody invited you… so there's the door… see ya!",0.05210770294070244,0.04869581013917923,0.005894859321415424,0.009648826904594898,0.10093910247087479,0.03484576195478439,0.8891595602035522,0.362921804189682,0.11339963227510452,0.457146555185318,0.5576974749565125
288,"We live in a world where the funeral matters more than the dead, the wedding more than love and the physical rather than the intellect. We live in the container culture, which despises the content.",0.06899848580360413,0.16006968915462494,0.005988224409520626,0.012084811925888062,0.07433950155973434,0.011556536890566349,0.4535442888736725,0.8387151956558228,0.009612093679606915,0.14148879051208496,0.759324312210083
289,Definition of Good and Evil: Good is what you like. Evil is what you don't like.,0.10306265950202942,0.7114703059196472,0.011403669603168964,0.07656370848417282,0.11801443994045258,0.006634613964706659,0.0758957639336586,0.7273855805397034,0.01584509387612343,0.057886481285095215,0.3333333730697632
290,I am firmly convinced that Spain is the strongest country of the world. Century after century trying to destroy herself and still no success,0.10704652965068817,0.4983416497707367,0.004815711174160242,0.03381205350160599,0.21175430715084076,0.01935567706823349,0.2050904929637909,0.6481801867485046,0.03852204233407974,0.13981769979000092,0.603320300579071
291,"wash the brush, just beats the devil out of it",0.37318646907806396,0.3478354811668396,0.005333715584129095,0.035673901438713074,0.3470662236213684,0.043504759669303894,0.025023862719535828,0.3531934916973114,0.008311470039188862,0.018666278570890427,0.21715454757213593
292,In three words I can sum up everything I've learned about life — It goes on.,0.5501554608345032,0.9423060417175293,0.020738083869218826,0.15109308063983917,0.2710188627243042,0.01389860175549984,0.062601737678051,0.02191137708723545,0.01443119440227747,0.033588290214538574,0.020514288917183876
293,"You can close your eyes to the things you don't want to see, but you can't close your heart to the things you don't want to feel.",0.311283677816391,0.9439561367034912,0.07761706411838531,0.22456982731819153,0.14714114367961884,0.009247091598808765,0.5472127795219421,0.013741345144808292,0.04746326059103012,0.1521032601594925,0.02191765233874321
294,"Everyting negative - pressure, challenges - is all an opportunity for me to rise.",0.3593319058418274,0.9840555191040039,0.03919398784637451,0.3854049742221832,0.16925106942653656,0.012959031388163567,0.0628562644124031,0.05912652984261513,0.08242490142583847,0.0511273629963398,0.030374374240636826
295,The tongue may hide the truth but the eyes—never!,0.11836905032396317,0.8113759160041809,0.011061837896704674,0.13373178243637085,0.3724270761013031,0.011777832172811031,0.06504000723361969,0.03918151557445526,0.037154436111450195,0.06334715336561203,0.03585301712155342
296,"I'm not interested in money, I just want to be wonderful.",0.9840884208679199,0.9602264165878296,0.5431218147277832,0.2809334993362427,0.09812277555465698,0.026540981605648994,0.017310773953795433,0.010644287802278996,0.015539431944489479,0.010900517925620079,0.007832668721675873
297,"Women are beautiful in the light of the day, but are even more so in the shadows of the night.",0.9843728542327881,0.9192506670951843,0.718244731426239,0.26005735993385315,0.08858518302440643,0.031203901395201683,0.016189059242606163,0.010447340086102486,0.014684386551380157,0.010101880878210068,0.00841659028083086
298,"The Barbican - an element of medieval fortifications; a circular defensive structure with loop-holes, in front of the town walls. In Europe this kind of building has been preserved only at Carcassonne (southern France), Zgorzelec (Görlitz), and of course in Cracow. (…) It was at that time, that one of the largest European buildings of this kind came to to exist in Cracow, being nowadays the best preserved example of the medieval barbican.",0.46772560477256775,0.31069400906562805,0.01735665649175644,0.09485361725091934,0.6731747388839722,0.07711152732372284,0.020561175420880318,0.028468556702136993,0.026139747351408005,0.018117152154445648,0.031094420701265335
299,Bless yourself first before expecting God to bless you.,0.8743575215339661,0.981833279132843,0.17347228527069092,0.45289602875709534,0.14493244886398315,0.01996147632598877,0.026204677298665047,0.018712764605879784,0.02424439787864685,0.018329236656427383,0.011318795382976532
300,Change happens by listening and then starting a dialogue with the people who are doing something you don't believe is right.,0.16213276982307434,0.9618141055107117,0.02855032868683338,0.4667151868343353,0.3871128559112549,0.021169152110815048,0.03982463479042053,0.20556890964508057,0.05658802390098572,0.06440576910972595,0.0785319060087204
301,"I don't sing my mother tongue
No, this is not a love song",0.09648953378200531,0.0349745899438858,0.006664744112640619,0.007713083177804947,0.1351422220468521,0.027439052239060402,0.5977804660797119,0.1457645446062088,0.017157841473817825,0.14374318718910217,0.311874657869339
302,There are two great days in a person's life - the day we are born and the day we discover why.,0.9715165495872498,0.9732325673103333,0.28828519582748413,0.30036067962646484,0.11595159024000168,0.023008834570646286,0.015465824864804745,0.014024928212165833,0.01687803491950035,0.01111588440835476,0.008976160548627377
303,"Solitude was my only consolation - deep, dark, deathlike solitude.",0.429252564907074,0.9407680630683899,0.06371486932039261,0.1297571063041687,0.06367769837379456,0.006830502301454544,0.5310353636741638,0.02453000470995903,0.02221100777387619,0.1148606389760971,0.0321517176926136
