Quote,all_tags
The beauty of mathematics only shows itself to more patient followers.,"optimism,anger,sadness,disgust,joy"
Darkness cannot drive out darkness: only light can do that. Hate cannot drive out hate: only love can do that.,"fear,anger,sadness,disgust,joy,optimism,love"
I tell my piano the things I used to tell you,"optimism,joy"
"Whenever you get there, there is no there there.","sadness,joy,optimism,love,pessimism"
"If I had a flower for every time I thought of you, I could walk through my garden forever.","anticipation,sadness,joy,optimism,love"
Never be afraid to trust an unknown future to a known God.,"fear,anticipation,sadness,joy,trust,optimism"
"This is what the past is for! Every experience God gives us, every person He puts in our lives is the perfect preparation for the future that only He can see.","trust,optimism,anticipation,sadness,joy"
"I think that truth is the highest value, although it has to be embedded in love. What I mean by that is that truth should serve the highest good imaginable. For me, that is what is best for each individual, in the manner that is simultaneously best for the family, and the state, and nature itself. But you can only want that good if you love Being.","fear,anger,sadness,anticipation,disgust,joy,optimism,love"
"There is a magnet in your heart that will attract true friends. That magnet is unselfishness, thinking of others first; when you learn to live for others, they will live for you.","fear,anger,sadness,joy,trust,optimism,love"
"Time is still the best critic, and patience the best teacher.","optimism,sadness,joy"
"Why not just tell people I'm an alien from Mars. Tell them I eat live chickens and do a voodoo dance at midnight. They'll believe anything you say, because you're a reporter. But if I, Michael Jackson, were to say, ""I'm an alien from Mars and I eat live chickens and do a voodoo dance at midnight,"" people would say, ""Oh, man, that Michael Jackson is nuts. He's cracked up. You can't believe a damn word that comes out of his mouth.""","anger,sadness,disgust,joy,optimism"
A TV evening with the right person can be more erotic than sex with the wrong one. ,"anticipation,anger,sadness,optimism,disgust,joy"
"Why do two colors, put one next to the other, sing? Can one really explain this? no. Just as one can never learn how to paint.","anticipation,anger,sadness,optimism,disgust,joy"
"When you have money in hand, only you forget who are you. But when you do not have any money in your hand, the whole world forget who you are. It's life.","optimism,sadness,disgust"
"If you see me in a fight with a bear, pray for the bear.","optimism,anger,disgust,joy"
"Only the weak will fall and give up, the strong falls 100 times and wakes up 200 times","optimism,sadness,pessimism,joy"
"When there's a person, there's a problem. When there's no person, there's no problem.","optimism,sadness,anger,disgust"
"Looking back on each element, the absence of the audience this time meant that it was difficult to make that connection [with the crowd], but there are a lot of movements in the choreography that try to speak to the audience, so I think that’s also a key appeal for this program.","fear,anticipation,sadness,anger,disgust,joy,optimism"
Truly free people do not need to be told they are free.,"optimism,disgust,anger,joy"
I never tried to prove anything to someone else. I wanted to prove something to myself.,"anticipation,optimism"
"What you do makes a difference, and you have to decide what kind of difference you want to make.","anticipation,optimism,joy"
"Do not try to rescue someone who does not want to be rescued, and be very careful about rescuing someone who does want to be rescued.","fear,optimism,anger,sadness,disgust"
"It's like I've got a shotgun in my mouth with my finger on the trigger, and I like the taste of the gun metal.","fear,anticipation,anger,sadness,disgust,joy,optimism"
"When the snow fall
and the white winds blow,
the lone wolf dies
but the pack survives.","anger,sadness,disgust,optimism"
"The rich
Will make temples for Siva
what shall I, a poor man, do?
My legs are pillars,
the body the shrine,
the head the cupola of gold,
Listen, O! Lord:
Standing things shall fall,
that which moves shall stay","pessimism,sadness,disgust,joy"
"I love you without knowing how, or when, or from where,
I love you simply, without problems or pride:
I love you in this way because I don’t know any other way of loving.","anger,sadness,disgust,joy,optimism,love"
"The richness I achieve comes from nature, the source of my inspiration.","optimism,joy"
"If you want to find the secrets of the universe, think in terms of energy, frequency and vibration.","fear,anticipation,optimism,joy"
"One time, Niall sat on the floor for hours trying to find a way of putting his M&M's in alphabetical order.",anticipation
"Elvis is my daddy, Marilyn's my mother, Jesus is my bestest friend.","optimism,love,joy"
"Life is short, but the years are long.","optimism,joy"
The Tenczyn castle dates from the 14th century and it was built as a defensive edifice by Andrzej Toporczyk who after some time took the name of Tenczyński - after the name of the place. For many years the castle was a source of power of the family who played an important part in the politics of old Poland.,"anticipation,optimism,sadness,joy"
It is the mark of an educated mind to be able to entertain a thought without accepting it.,"anticipation,optimism,sadness,joy"
"Live simply, love generously, care deeply, speak kindly, leave the rest to God.","optimism,love,sadness,joy"
"If I know what love is, it is because of you.","fear,anticipation,sadness,anger,disgust,joy,optimism,love,pessimism"
"I go through a lot of depression, and I know other people do, too, but I have an outlet that so many people don't. If you have that inside of you and can't get it out, what do you do?","anger,sadness,pessimism,disgust"
"People will do anything, no matter how absurd, in order to avoid facing their own souls.","anger,disgust,joy"
"The history of the castle at Wiśnicz Nowy is enlivened by many legends. Many well-known artists visited the castle in centuries past. Till now, many elements of old architecture (towers, chapel) have survived, together with some details of interior design.","anticipation,optimism,joy"
"The chance to overcome another challenge is simply, as I always feel, a blessing.","optimism,love,sadness,joy"
Don't be afraid of enemies who attack you. Be afraid of the friends who flatter you.,"fear,anger,disgust,joy"
Man invented the car to comfortably sit in jams.,"optimism,sadness,joy"
"I know it seems hard sometimes but remember one thing. Through every dark night, there's a bright day after that. So no matter how hard it get, stick your chest out, keep ya head up…. and handle it.","trust,fear,optimism,sadness,joy"
"Unhappiness. There are all kinds of unhappy people in the world. I suppose it would be no exaggeration to say that the world is composed entirely of unhappy people. But those people can fight their unhappiness with society fairly and squarly, and society for its part easily understands and sympathizes with such struggles. My unhappiness stemmed entirely from my own vices, and I had no way of fighting anybody.","fear,anger,sadness,disgust,joy,optimism,pessimism"
"Pooh, how do you spell love?' 'You don't spell love Piglet, you feel it","optimism,love,sadness,joy"
"The tragedy of a thoughtless man is not that he doesn't think, but that he thinks that he's thinking.","fear,optimism,sadness,pessimism"
"Life is painful. It has thorns, like the stem of a rose. Culture and art are the roses that bloom on the stem. The flower is yourself, your humanity. Art is the liberation of the humanity inside yourself.","sadness,disgust,joy,optimism,pessimism"
"I know that I'm not that important to you But to me, girl, you're so much more than gorgeous So much more than perfect Right now I know that I'm not really worth it","optimism,love,sadness,joy"
This place makes me think about the mistakes I've made in the past… and I've made so many of them.,"fear,sadness,disgust,joy,optimism,love"
One man with a gun can control 100 without one.,"fear,anticipation,anger,sadness,disgust"
It’s better to be absolutely ridiculous than absolutely boring.,"optimism,anger,love,disgust,joy"
"I always just thought if you see somebody without a smile, give'em yours!","optimism,anticipation,joy"
and should be entitled to have access to education according to their competency and needs.,"anticipation,optimism,joy"
The most worth-while thing is to try to put happiness into the lives of others.,"optimism,joy"
"Never, ever, let anyone tell you what you can and can't do. Prove the cynics wrong. Pity them for they have no imagination. The sky's the limit. Your sky. Your limit. Now. Let's dance.","anger,anticipation,sadness,disgust,joy,optimism"
Art is a big question mark.,fear
"Close your eyes and I'll kiss you, Tomorrow I'll miss you.","anticipation,sadness,love,joy"
Here is my secret. It is very simple. It is only with the heart that one can see rightly; What is essential is invisible to the eye.,"optimism,love,sadness,joy"
"Lesser, greater, middling, it's all the same. Proportions are negotiated, boundaries blurred. I'm not a pious hermit, I haven't done only good in my life. But if I'm to choose between one evil and another, then I prefer not to choose at all.","optimism,anger,disgust,joy"
"Yesterday is but a dream,
Tomorrow is only a vision.
But today well lived makes every yesterday a dream of happiness, and every tomorrow a vision of hope.","optimism,anticipation,joy"
"I think that living only from writing is a privilege, in economic terms, that only some writers have achieved and to which, probably, all authors aspire: a difficult goal that is not impossible.","fear,optimism,anger,anticipation,disgust,joy"
It's so much easier to know who you are when there aren't a thousand people telling you who they think you are.,"fear,anticipation,optimism,anger,disgust"
"What hurts you, blesses you. Darkness is your candle.","fear,anger,sadness,disgust,joy,optimism,love,pessimism"
"we aim for the practice of Christianity in their everyday life and dealings, and not merely the profession of its theology on Sundays.","optimism,joy"
"In the second half of the 18th century, first residences-museums were created in Poland. Old palaces were changed to adapt them for exhibitions purposes, or new buildings were erected with separate museum annexes. First such museums in Poland was established in 1802 by Stanisław Kostka Potocki at Wilanów. The museums at Nieborów, Nieśwież, Puławy, Rogalin, Gołuchów and Kórnik followed. At first these museums were established as a response to fashion, later national and patriotic issues became prevailing reasons.","anticipation,optimism,sadness,anger,disgust"
Change is good only when you know yourself.,"optimism,joy"
The first duty of a revolutionary is to be educated.,"anticipation,optimism,joy"
"Coming together is a beginning, staying together is progress, and working together is success.","optimism,joy"
"Light thinks it travels faster than anything but it is wrong. No matter how fast light travels, it finds the darkness has always got there first, and is waiting for it.","fear,optimism,anger,sadness,anticipation,disgust,joy"
I'm married to my money because it never cheats on me,"anger,sadness,disgust,joy,optimism"
"If you don't love yourself, how in the hell you gonna love somebody else?","anger,sadness,disgust,joy,optimism,love"
"What nearly everybody in my life had misunderstood about Satanism was that it is not about ritual sacrifices, digging up graves and worshipping the devil. The devil doesn't exist. Satanism is about worshipping yourself, because you are responsible for your own good and evil.","fear,anger,sadness,disgust,joy,optimism"
"This generation has lost the true meaning of romance. There are so many songs that disrespect women. You can’t treat the woman you love as a piece of meat. You should treat your love like a princess. Give her love songs, something with real meaning. Maybe I’m old fashioned but to respect the woman you love should be a priority.","anger,anticipation,disgust,joy,optimism,love"
"(on Ashley Tisdale) ""You don't need a prince to be a princess.""","anticipation,optimism,love,joy"
"As democracy is perfected, the office of president represents, more and more closely, the inner soul of the people. On some great and glorious day the plain folks of the land will reach their heart's desire at last and the White House will be adorned by a downright moron.","anger,sadness,disgust,joy,optimism,love"
"Shout out to everyone makin' my beats, you helpin' me preach This music's the only thing keepin' the peace when I'm fallin' to pieces","optimism,anger,sadness,disgust,joy"
I have not told half of what I saw.,anticipation
"The music is not in the notes,
but in the silence between.","anticipation,sadness,disgust,joy"
"Now it is established in the sciences that no knowledge is acquired save through the study of its causes and beginnings, if it has had causes and beginnings; nor completed except by knowledge of its accidents and accompanying essentials.","fear,anticipation,optimism,anger,disgust,joy"
Sorry I'm late. You wouldn't believe the traffic.,"anger,sadness,optimism,disgust,joy"
Let everything happen to you: beauty and terror. Just keep going. No feeling is final.,"fear,anger,sadness,disgust,joy,optimism"
We are never so defenceless against suffering as when we love.,"sadness,joy,optimism,love,pessimism"
"I went to the woods because I wanted to live deliberately. I wanted to live deep and suck out all the marrow of life. To put to rout all that was not life; and not, when I had come to die, discover that I had not lived.","anger,sadness,disgust,joy,optimism,pessimism"
I don't know why people are so keen to put the details of their private life in public; they forget that invisibility is a superpower.,"anger,optimism,sadness,disgust"
"Wake up and smell the coffee
Is your cup half full or empty?","anticipation,sadness,joy"
"If I'm in a bad mood, or if I'm uncomfortable, it's probably what I'm wearing that's making me feel that way.","sadness,disgust,joy,optimism,love,pessimism"
"You just stay patient, that's all.","trust,optimism,anger,sadness,disgust,joy"
The good times of today are the sad thoughts of tomorrow.,"anticipation,sadness,joy,optimism,pessimism"
"Fear is stronger than love, remember that. Fear is stronger than love, all that love I gave didn't mean nothing when it came to fear.","fear,anger,sadness,disgust,joy,optimism,love"
"This time the struggle is for our freedom, this time the struggle is for our independence! Joy bangla!","fear,optimism,sadness,pessimism,joy"
"I am that clumsy human, always loving, loving, loving. And loving. And never leaving.","optimism,love,joy"
"Fear is the true enemy, the only enemy.","fear,optimism,anger,disgust"
The good you do today will be forgotten tomorrow. Do good anyway!,"optimism,anticipation,joy"
"At this point I have a request for our fans. If any of you in any way hate homosexuals, people of different color, or women, please do this one favor for us - leave us the fuck alone! Don't come to our shows and don't buy our records.","anger,sadness,disgust,joy,optimism,love"
"The genius may appear selfish, but most of his intentions are always innocent and pure.","anger,anticipation,sadness,disgust,joy,optimism"
"Satanism condones any type of sexual activity which properly satisfies your individual desires – be it heterosexual, homosexual, bisexual, or even asexual, if you choose. Satanism also sanctions any fetish or deviation which will enhance your sex-life, so long as it involves no one who does not wish to be involved.","anticipation,optimism,anger,sadness,disgust,joy"
"Diabolical forces are formidable. These forces are eternal, and they exist today. The fairy tale is true. The devil exists. God exists. And for us, as people, our very destiny hinges upon which one we elect to follow.","fear,optimism,anger,sadness,disgust"
Whoever is happy will make others happy too.,"optimism,love,joy"
"Life is a song - sing it.
Life is a game - play it.
Life is a challenge - meet it.
Life is a dream - realize it.
Life is a sacrifice - offer it.
Life is love - enjoy it.","anticipation,anger,disgust,joy,optimism,love"
"I exist not to be loved and admired, but to love and act. It is not the duty of those around me to love me. Rather, it is my duty to be concerned about the world, about man.","fear,sadness,joy,optimism,love"
"All heaven's glory is within and so is hell's fierce burning.
You must yourself decide in which direction you are turning","optimism,anger,sadness,disgust,joy"
Judge not unless you judge yourself,optimism
There is no way to happiness. Happiness is the way.,"optimism,love,joy"
"My body is my journal, and my tattoos are my story.","optimism,sadness,joy"
You must never be fearful of what you are doing when it is right.,"fear,optimism"
"Nationalism is so beautiful for nationalists. At the same time, you are really opposed to the unification of the world.","optimism,anger,disgust,joy"
"If you cut a branch out of my forests, I'd cut your head off!","anger,disgust"
There are no dangerous thoughts; thinking it-self is dangerous.,"fear,anticipation,optimism"
"If you steal from one book you are condemned as a plagiarist, but if you steal from ten books you are considered a scholar, and if you steal from thirty or forty books, a distinguished scholar.","anger,optimism,joy"
War is over… If you want it.,"anger,optimism,disgust"
I dream big because I believe I am what I think I am,"fear,optimism,joy"
"It is, therefore, upon you as the programmer of your life, to pay more attention if you truly wish to succeed at the end of your journey.","optimism,sadness,joy"
What you spend years building may be destroyed overnight. Build anyway!,"anticipation,optimism,sadness,joy"
"People always said that I didn't give up my seat because I was tired, but that isn't true. I was not tired physically, or no more tired than I usually was at the end of a working day. I was not old, although some people have an image of me as being old then. I was forty-two. No, the only tired I was, was tired of giving in.","anger,sadness,disgust"
"(We make the traffic stop) ""Stop the traffic…let 'em through…""","anger,disgust"
Stand up for what you believe in even if you are standing alone.,"trust,optimism,joy"
I believe in equal rights for everyone. I think God loves all,"fear,sadness,joy,trust,optimism,love"
"It's OK to eat fish
'Cos they don't have any feelings","optimism,sadness,disgust,anger"
"Music is enough for a lifetime, but a lifetime is not enough for music.","optimism,joy"
"Since we all came from a women, got our name from a women, and our game from a women. I wonder why we take from women, why we rape our women, do we hate our women? I think its time we killed for our women, be real to our women, try to heal our women, cus if we dont we'll have a race of babies that will hate the ladies, who make the babies. And since a man can't make one he has no right to tell a women when and where to create one","fear,anger,sadness,anticipation,disgust,joy,love"
Rise to the challenges that life presents you. You can't develop genuine character and ability by sidestepping adversity and struggle.,"fear,anticipation,sadness,joy,trust,optimism,pessimism"
"As a realist, you must give me the watch and not the time.","anticipation,optimism"
"You say you love rain, but you use an umbrella to walk under it. You say you love sun, but you seek shelter when it is shining. You say you love wind, but when it comes you close your windows. So that's why I'm scared when you say you love me.","fear,sadness,disgust,joy,optimism,love"
"Intellect takes you to the door, but it doesn't take you into the house.",
A dream you dream alone is only a dream. A dream you dream together is reality.,"anticipation,optimism,joy"
"Worry more about your character than your reputation. Character is what you are, reputation merely what others think you are.","fear,anticipation,optimism"
"I am an optimist... I choose to be. There is a lot of darkness in our world, there is a lot of pain and you can choose to see that or you can choose to see the joy. If you try to respond positively to the world, you will spend your time better.","fear,sadness,disgust,joy,optimism,pessimism"
".. When an individual, e. g. higher forms of animals, thinks, it is always for his own advantage whether the resulting action or expression is favorable or not to the onlookers or observers.","fear,anticipation,optimism,love,joy"
I was never really insane except upon occasions when my heart was touched.,"sadness,joy,optimism,love"
"And so being young and dipped in folly, I fell in love with melancholy.","optimism,love,sadness,joy"
The biggest coward of a man is to awaken the love of a woman without the intention of loving her.,"anger,sadness,anticipation,disgust,joy,optimism,love,pessimism"
Music is the strongest form of magic.,"optimism,joy"
"Hatred is like a Hydra - the more heads one chops off, the stronger it grows.","anger,sadness,optimism,disgust,joy"
"I used to get upset by people not understanding me, but I’ve made a career out of it now.","optimism,anger,disgust,joy"
A genius is born whenever he proves many facts wrong.,"anticipation,anger,sadness,disgust,joy,optimism"
"Hey guys, sorry I'm late, I'm afraid I got lost on the path of life.","fear,optimism,sadness,pessimism"
It's all true that education will make you intelligent. But it can't automatically make you a good person too.,"optimism,anticipation,joy"
Sometimes life hits you in the head with a brick. Don’t lose faith.,"optimism,anger,disgust,joy"
"Your critics are your bestfriends, they push you to become the best version of yourself","trust,optimism,joy"
"Where is the wisdom we have lost in knowledge?
Where is the knowledge we have lost in infomation?","optimism,sadness,joy"
"If slaughterhouses had glass walls, we would all be vegetarian.",disgust
Your naked body should only belong to those who fall in love with your naked soul.,"optimism,love,sadness,joy"
I'd rather take coffee than compliments just now.,"optimism,sadness,joy"
"We’re gonna stay together until we die, I’m sure of it.","pessimism,optimism,sadness,joy"
"I thought, “I want to die. I want to die more than ever before. There’s no chance now of a recovery. No matter what sort of thing I do, no matter what I do, it’s sure to be a failure, just a final coating applied to my shame. That dream of going on bicycles to see a waterfall framed in summer leaves—it was not for the likes of me. All that can happen now is that one foul, humiliating sin will be piled on another, and my sufferings will become only the more acute. I want to die. I must die. Living itself is the source of sin.","fear,anticipation,sadness,anger,disgust,joy,optimism,pessimism"
"Communication is an essential factor in any type of relationship; friend, romantic, or business.","optimism,anticipation,joy"
"The party is Hitler, Hitler is Germany, and Germany is Hitler! Sieg heil!","fear,anger,disgust,joy"
"I have a problem when people say something's real or not real, or normal or abnormal. The meaning of those words for me is very personal and subjective. I've always been confused and never had a clearcut understanding of the meaning of those kinds of words.","anger,sadness,disgust,joy,optimism"
"Why walk with half measures, animals know much more than people, above all because they feel more freely than most of these and, therefore, as Kafka says, they are possessors of all the knowledge about this life. They are just too humble to show it off.","optimism,anticipation,sadness,anger,disgust,joy"
"If you loved someone, you loved him, and when you had nothing else to give, you still gave him love.","sadness,disgust,joy,optimism,love"
"Heroes come and go, but legends are forever.","optimism,joy"
I used to think anyone doing anything weird was weird. Now I know that it is the people that call others weird that are weird.,"fear,anger,anticipation,disgust,surprise"
"If we would despise the enemy, our thoughts must always be of God and our souls always glad with hope.","anticipation,anger,sadness,disgust,joy,optimism"
"The fight is here. I need ammunition, not a ride.","anticipation,disgust,anger,joy"
"No one is afraid of heights, they're afraid of falling down. No one is afraid of saying I love you, they're afraid of the answer…","fear,sadness,joy,optimism,love,pessimism"
To play a wrong note is insignificant; to play without passion is inexcusable,"anger,sadness,disgust,joy,optimism,love"
"Life is good, life is great.
Alaways love and never hate.
Break the rules, stand apart.
Ignore your head, and follow your heart.","anger,sadness,disgust,joy,trust,optimism,love"
"You see, but you do not observe.",
"For every album I’ve ever made, I’ve written many times more music than has actually been released, and the way I choose which music appears is almost totally random, but one thing I have never done is to make music for the sake of commercialism","anticipation,optimism,joy"
"One love, one heart, one destiny.","anger,sadness,disgust,joy,optimism,love"
"I am not what happened to me, I am what I choose to become.","optimism,joy"
"People say ""Ted Bundy didn't show any emotion, there must be something in there"". I showed emotion. You know what people said? ""See, he really can get violent and angry.""","anger,disgust,joy"
"We’re confident people will take to us, because although the camp image has already been established by people like Bowie and Bolan we are taking it to another level.","anticipation,anger,disgust,joy,trust,optimism"
"If it's illegal to rock and roll, then throw me in jail.","anger,sadness,disgust"
