Quote,all_tags
Anyone who has never made a mistake has never tried anything new.,"anticipation,optimism,sadness,disgust,joy"
The secret to getting ahead is getting started.,"optimism,sadness,love,pessimism,joy"
You have to be true to who you are.,"anticipation,optimism"
"Reading is the greatest thing ever, I've read alot that I know what very few people know… That the stars in the night sky are suns and that there are earth-like planets orbiting those stars, meaning there are other planets like earth out there… Reading is great","optimism,anger,disgust,joy"
Do not feel ashamed to forgive and forget.,"optimism,sadness,disgust,joy"
I would rather die of passion than of boredom.,"optimism,love,sadness,pessimism,joy"
Art is to console those who are broken by life.,"optimism,sadness"
"As we tell stories about the lives of others, we learn how to imagine what another creature might feel in response to various events. At the same time, we identify with the other creature and learn something about ourselves.","anticipation,anger,sadness,disgust,joy,optimism"
"there is a place in the heart that
will never be filled

a space

and even during the
best moments
and
the greatest times
times

we will know it

we will know it
more than
ever

there is a place in the heart that
will never be filled
and

we will wait
and
wait

in that space.","optimism,sadness,love,disgust,joy"
"Listen, smile, agree, and then do whatever the fuck you were gonna do anyway","anger,optimism,disgust,joy"
We have the choice to use the gift of our life to make the world a better place--or not to bother,"optimism,anger,sadness,disgust,joy"
I love walking in the rain because no one can see me crying,"sadness,disgust,joy,optimism,love,pessimism"
"If I got rid of my demons, I’d lose my angels.","optimism,sadness,anger,disgust,joy"
Only God can judge me now,"trust,optimism,sadness,joy"
"Columbus was not the first one to discover America, only the first to patent it.",anticipation
"Don't feel bad when you meet disappointment, it prepares you for an extraordinary ending","pessimism,anticipation,optimism,sadness"
"You can spend minutes, hours, days, weeks, or even months over-analyzing a situation; trying to put the pieces together, justifying what could've, would've happened… or you can just leave the pieces on the floor and move on.","optimism,sadness,joy"
"I put my heart and soul into my work, and I have lost my mind in the process.","optimism,sadness,love,joy"
"All I feel are the assaults of apprehension and terror at the thought that I am the only one who is entirely unlike the rest. It is almost impossible for me to converse with other people. What should I talk about, how should I say it? - I don't know.","fear,anticipation,sadness,anger,disgust,joy"
"Everything was already predestined by God, that is why Jesus saw the people’s ignorance.","optimism,sadness,disgust,anger"
"Let it go, you've got to forget about revenge. Believe me, in this work I've met a lot of guys who feel the way you do. Trust me, for those who follow the path of revenge, it never ends well. You'll only tear yourself apart and even if you succeed with your revenge, what would you have then... nothing, emptiness.","fear,anger,sadness,disgust,joy,trust,optimism"
"Bodies have their own light which they consume to live: they burn, they are not lit from the outside.","anger,sadness,optimism,disgust,joy"
"The secret of spiritual success is a hunger that persists…It is an awful condition to be satisfied with one’s spiritual attainments…God was and is looking for hungry, thirsty people.","fear,anger,sadness,disgust,joy,optimism"
One book makes a complete religion. Let the future authors aim for quality rather than quantity.,"optimism,anticipation,joy"
Magick is the Science and Art of causing Change to occur in conformity with Will.,"optimism,joy"
Play Mozart in memory of me— and I will hear you.,"optimism,love,joy"
Serious tweet: we all must learn to be happy with being alone; that is when things begin to change.,"optimism,sadness,joy"
You can not open the mind of another if you do not have an open mind yourselves.,"optimism,sadness"
"What about sunrise, what about rain?
What about all the things that you said we were to gain?
What about flowering fields, is there a time?
What about all the dreams that you said was yours and mine?","anticipation,optimism,sadness,disgust,joy"
"The deepest secret is that life is not a process of discovery, but a process of creation. You are not discovering yourself, but creating yourself anew. Seek, therefore, not to find out Who You Are, seek to determine Who You Want to Be.","optimism,anticipation,joy"
Why are women… so much more interesting to men than men are to women?,"anticipation,disgust,joy"
Big Brother is Watching You.,"fear,anticipation"
"I never said to be like me, I say to be like you and make a difference.","trust,optimism,joy"
There is no spectacle on earth more appealing than that of a beautiful woman in the act of cooking dinner for someone she loves.,"optimism,love,joy"
To be beautiful means to be yourself. You don’t need to be accepted by others. You need to accept yourself.,"optimism,anger,love,disgust,joy"
In my case such an expression as 'to be fallen for' or even 'to be loved' is not in the least appropriate; perhaps it describes the situation more accurately to say that I was 'looked after.,"anger,sadness,disgust,joy,optimism,love"
Accuse the other side of that which you are guilty.,"anger,sadness,optimism,disgust"
"I am the Lizard King, I can do anything!","trust,optimism,joy"
Music makes things hurt less.,"optimism,sadness,pessimism,joy"
"If teardrops could be bottled
There'd be swimming pools filled by models
Told a tight dress is what makes you a whore
If ""I love you"" was a promise
Would you break it, if you're honest
Tell the mirror what you know she's heard before
I don't wanna be you anymore","fear,anger,sadness,anticipation,disgust,joy,optimism,love"
"So you're a tough guy
Like-it-really-rough guy
Just-can't-get-enough guy
Chest-always-so-puffed guy
I'm that bad type
Make-your-mama-sad type
Make-your-girlfriend-mad type
Might-seduce-your-dad type
I'm the bad guy, duh
I'm the bad guy","anger,sadness,disgust,joy,optimism,love,pessimism"
"I can write the saddest poem of all tonight. I loved her, and sometimes she loved me too.","anticipation,sadness,joy,optimism,love"
My garden is my most beautiful masterpiece,"optimism,love,anticipation,joy"
"For every book you buy, you should buy the time to read it.","anticipation,optimism,joy"
"I will show you the way
To Africa comes Santa Claus
and before Paris stands Mickey Mouse.","anticipation,optimism,joy"
"I was always fascinated by people who are considered completely normal, because I find them the weirdest of all","anticipation,anger,disgust,joy,optimism,surprise"
Adulthood is within the mind and not in age.,"anticipation,optimism,sadness"
I don't care what you think unless it is about me.,"fear,anger,sadness,disgust"
"In other to be a successful leader you must be heartless, heart makes you weak","optimism,sadness,love,pessimism,joy"
"Peace, love, empathy","optimism,love,sadness,joy"
The first true love is always the last one.,"optimism,love,joy"
"I was drawn to all the wrong things: I liked to drink, I was lazy, I didn't have a god, politics, ideas, ideals. I was settled into nothingness; a kind of non-being, and I accepted it. I didn't make for an interesting person. I didn't want to be interesting, it was too hard. What I really wanted was only a soft, hazy space to live in, and to be left alone.","anticipation,sadness,anger,disgust,joy,optimism,pessimism"
"The world's a little blurry
Or maybe it's my eyes","pessimism,sadness"
I don't think there is any truth. There are only points of view.,"fear,sadness,disgust"
The dictionary is the holy book of the geniuses. It's the only way that you can learn new word(s) daily.,"optimism,joy"
I have no special talents. I am only passionately curious.,"anticipation,optimism,love,joy"
"Whatever you know, or don't - only Love is real.","optimism,love,joy"
"I must have flowers, always, and always.","optimism,love,joy"
"My brain is only a receiver. In the universe there is a core from which we obtain knowledge, strength, inspiration. I have not penetrated into the secrets of this core, but I know that it exists.","optimism,joy"
"Give me your body and let me love you like I do
Come a little closer and let me do those things to you
This feeling will last forever, baby, that's the truth
Let me be your man so I can love you","optimism,love,sadness,joy"
I fall in love with everything I also hate everything. It’s very hard to be a misanthrope and a romantic.,"anger,sadness,disgust,joy,optimism,love"
"When you feel the last bit of breath leaving their body, you're looking into their eyes. A person in that situation is God!","trust,optimism,sadness,joy"
Love is like war: easy to begin but very hard to stop.,"anger,disgust,joy,optimism,love"
I recommend that the Statue of Liberty on the East Coast be supplemented by a Statue of Responsiblity on the West Coast.,"anticipation,optimism,joy"
"Some people want it to happen, some wish it would happen, others make it happen.","anticipation,optimism,anger,disgust,joy"
Pain is just a consequence of love.,"sadness,disgust,joy,optimism,love,pessimism"
"I never cared about the money, that's not why I started acting, and I never liked the fame. The paparazzi culture is more pervasive than it used to be, kind of: 'Let's watch the actor pump gas.' It's nice not to have to worry about bills, though.
It's a cliche that money doesn't buy you happiness, but it does buy you the freedom to live your life the way you want.","fear,anger,sadness,disgust,joy,optimism"
"I had a dream
I got everything I wanted
But when I wake up, I see
You with me

And you say
As long as I'm here
No one can hurt you
Don't wanna lie here
But you can learn to
If I could change the way that you see yourself
You wouldn't wonder why you hear
""They don't deserve you""","anticipation,sadness,anger,disgust,joy,optimism,pessimism"
"Stars,"" she whispered. ""I can see the stars again, my lady.""
A tear trickled down Artemis's cheek. ""Yes, my brave one. They are beautiful tonight.""
Stars,"" Zoe repeated. Her eyes fixed on the night sky. And she did not move again.","fear,anticipation,sadness,joy,optimism,love,pessimism"
"You know it's funny, when it rains it pours
they got money for wars, but can't feed the poor.","anger,sadness,disgust,joy,optimism,pessimism"
It is never too late to be what you might have been.,"optimism,joy"
Don't cry because it's over. Smile because it happened.,"optimism,sadness,pessimism,joy"
"Action may not always bring happiness, but there is no happiness without action.","optimism,joy"
Life isn't about how popular you are… What girl or boy you are dating or who you know.Life is about always being true to who you are or what you believe in. Never let anyone convince you that their way is better than your way. In the end all we have is our hearts… and our minds. This is the reason we sing… this is the reason we cry… this is why we live.,"anticipation,sadness,joy,optimism,love,pessimism"
The problem is that everybody treats teenagers like they're stupid.,"anger,sadness,disgust,joy,optimism"
Part of me is afraid to get close to people because I'm afraid that they're going to leave.,"fear,anger,sadness,pessimism,disgust"
The immortality of the soul is that there is no death without life and there is no life after death. Life goes on.,"optimism,sadness,joy"
"Economic, social, political, environmental and population development in Thailand have created a series of problems that must be addressed addressesed by education.","anticipation,optimism,anger,sadness,disgust"
Talk is cheap. Show me the code.,"anticipation,optimism,joy"
"We do not conquer the lands, we conquer the hearts.","optimism,love,sadness,joy"
Retaliation gets you nothing. Revenge is worthless.,"anger,sadness,disgust"
Take a lover who looks at you like maybe you are magic.,"anticipation,sadness,joy,optimism,love"
"The secret of sound education is to get each pupil to learn for himself, instead of instructing him by driving knowledge into him on a stereotyped system.","anticipation,optimism,joy"
"I would like to get rid of the homophobes, sexists, and racists in our audience. I know they're out there and it really bothers me.","anger,sadness,anticipation,disgust,joy,optimism"
On film you put all your energies into a single glance. ,"anticipation,optimism,joy"
Honesty and frankness make you vulnerable. Be honest and frank anyway!,"trust,optimism,joy"
"People are just as wonderful as sunsets if I can let them be… When I look at a sunset, I don’t find myself saying, ""Soften the orange a bit on the right hand corner""… I don’t try to control a sunset. I watch with awe as it unfolds.","optimism,anticipation,anger,disgust,joy"
"Relying upon facts is claiming that you “know it all”, while a genius must go beyond these facts and prove them on his own.","anticipation,optimism,joy"
Any girl can be glamorous. All you have to do is stand still and look stupid.,"anger,sadness,disgust,joy,optimism"
"If you go through life without connecting to people, how much could you call that a life?","optimism,sadness,anger,pessimism,disgust,joy"
"Words are more powerful than some noises. Noises won't last long. Lyrics are so important, and people don't realise that.","anticipation,optimism,anger,disgust,joy"
To be happy does not mean to indulge in foolishness!,"optimism,anger,sadness,disgust,joy"
"If you have ever seen the play Peter Pan you will remember how the pirate chief was always making his dying speech because he was afraid that possibly when the time came for him to die he might not have time to get it off his chest. It is much the same with me, and so, although I am not at this moment dying, I shall be doing so one of these days and I want to send you a parting word of goodbye.

Remember, it is the last you will ever hear from me, so think it over.

I have had a most happy life and I want each one of you to have as happy a life too.

I believe that God put us in this jolly world to be happy and enjoy life. Happiness doesn't come from being rich, nor merely from being successful in your career, nor by self-indulgence. One step towards happiness is to make yourself healthy and strong while you are a boy, so that you can be useful and so can enjoy life when you are a man.

Nature study will show you how full of beautiful and wonderful things God has made the world for you to enjoy. Be contented with what you have got and make the best of it. Look on the bright side of things instead of the gloomy one.

But the real way to get happiness is by giving out happiness to other people. Try and leave this world a little better than you found it and when your turn come to die, you can die happy in feeling that at any rate you have not wasted your time but have done your best. ""Be Prepared"" in this way, to live happy and to die happy - stick to your Scout promise always - even after you have ceased to be a boy - and God help you do it.","fear,anger,sadness,anticipation,disgust,joy,optimism,pessimism"
"It's not worth the bother of killing yourself, since you always kill yourself too late.","anger,sadness,disgust,pessimism"
"My heart is broke, but I have some glue, help me inhale and mend it with you.","optimism,sadness,love,joy"
"My greatest strength is the love for my people, my greatest weakness is that I love them too much.","anger,sadness,disgust,joy,optimism,love,pessimism"
"If you look at the world, you'll be distressed. If you look within, you'll be depressed. If you look at God you'll be at rest.","pessimism,optimism,sadness"
Art should comfort the disturbed and disturb the comfortable.,"optimism,joy"
"Many that live deserve death. Some that die deserve life. Can you give it to them? Then do not be too eager to deal out death in judgment, for even the very wise cannot see all ends.","optimism,sadness,pessimism,joy"
"Scientist believe in things, not in person","anticipation,optimism,joy"
I wish I could throw off the thoughts which poison my happiness.,"anticipation,sadness,anger,disgust,joy,optimism"
"The minute you start caring about what other people think, is the minute you stop being yourself.","fear,optimism,anger,sadness,disgust"
There is no need to carry me to another prison. My life is already ebbing away. I suggest that you nail me to a cross and burn me alive. My flaming body will be a torch to light my people on their path to freedom.,"fear,anger,sadness,anticipation,disgust,joy,optimism"
"If a machine is expected to be infallible, it cannot also be intelligent.","anticipation,optimism"
We're all damaged in our own way. Nobody's perfect. I think we're all somewhat screwy. Every single one of us.,"fear,anger,sadness,disgust,joy,optimism,pessimism"
"It's my life and you know what, nobody invited you… so there's the door… see ya!","optimism,sadness,pessimism,disgust"
"We live in a world where the funeral matters more than the dead, the wedding more than love and the physical rather than the intellect. We live in the container culture, which despises the content.","anger,sadness,disgust,joy,optimism,love,pessimism"
Definition of Good and Evil: Good is what you like. Evil is what you don't like.,"anger,optimism,disgust,joy"
I am firmly convinced that Spain is the strongest country of the world. Century after century trying to destroy herself and still no success,"anger,optimism,sadness,disgust,joy"
"wash the brush, just beats the devil out of it","fear,anger,sadness,disgust"
In three words I can sum up everything I've learned about life — It goes on.,"optimism,joy"
"You can close your eyes to the things you don't want to see, but you can't close your heart to the things you don't want to feel.","optimism,sadness,love,pessimism,joy"
"Everyting negative - pressure, challenges - is all an opportunity for me to rise.","optimism,joy"
The tongue may hide the truth but the eyes—never!,"optimism,sadness"
"I'm not interested in money, I just want to be wonderful.","optimism,love,anticipation,joy"
"Women are beautiful in the light of the day, but are even more so in the shadows of the night.","fear,optimism,love,joy"
"The Barbican - an element of medieval fortifications; a circular defensive structure with loop-holes, in front of the town walls. In Europe this kind of building has been preserved only at Carcassonne (southern France), Zgorzelec (Görlitz), and of course in Cracow. (…) It was at that time, that one of the largest European buildings of this kind came to to exist in Cracow, being nowadays the best preserved example of the medieval barbican.","anticipation,anger,sadness,optimism,disgust,joy"
Bless yourself first before expecting God to bless you.,"anticipation,sadness,joy,trust,optimism,love"
Change happens by listening and then starting a dialogue with the people who are doing something you don't believe is right.,"trust,optimism,anger,disgust,joy"
"I don't sing my mother tongue
No, this is not a love song","optimism,love,sadness,joy"
There are two great days in a person's life - the day we are born and the day we discover why.,"optimism,love,joy"
"Solitude was my only consolation - deep, dark, deathlike solitude.","fear,optimism,sadness,joy"
Time is a drug. Too much of it kills you.,"optimism,sadness,anger,disgust"
Don't ever change yourself to impress someone. They should be impress that you don't change to please others,"optimism,sadness"
"Struck intensely tonight by the thought that we live in a great age. We can make music, food, pictures, art, & love with unbelievable unprecedented freedom. It's all there, there for the taking & the making, all the time.","optimism,love,anticipation,joy"
"I declare to the whole world, the Bosnians are under protection. No one can disturb these people nor their churches, nor harm them. Nobody in the world will touch these people and not harm them.","fear,optimism,anger,sadness,pessimism,disgust"
"It's not only the question, but the way you try to solve it.","anticipation,optimism"
There are only two types of people in this world: those who die for freedom and those who died for their religions. Both are considered martyrs.,"anger,sadness,disgust,joy,optimism,pessimism"
"Let grammar, punctuation, and spelling into your life! Even the most energetic and wonderful mess has to be turned into sentences.","anticipation,anger,sadness,disgust,joy,optimism"
"If you do not want it to rain, always carry an umbrella.","optimism,sadness,disgust"
"To the angel of death, we are all like chess pieces on the chessboard.","optimism,sadness,joy"
"I think everybody deserves an equal amount of appreciation whether how old they are, but I mean, I'm cool with the praise. I'm good.","fear,anger,disgust,joy,optimism,love"
"Before you judge someone else, judge yourself!",optimism
Life would be tragic if it weren't funny.,"optimism,sadness,joy"
You get depressed because you know that you're not what you should be.,"pessimism,sadness"
"I was trying to figure out what I’m doing, and that was the first time I was constantly being kicked down for doing that. When I didn’t know, I just wanted to say, ‘This is what I want, this is where I am in my professional life, things changed in my personal life, things changed in my heart — everything.’ And people just thought, ‘Alright, this is what we think.’ And yeah, I made some decisions that weren’t great as well, and so did he and that’s why we went through all that to only make us better. And he has heard [the song] and he has seen the video, and it’s something that I feel like girls need hear, and it’s something I’m willing to share with people.","fear,anticipation,sadness,anger,disgust,joy,optimism,love,pessimism"
It is an acknowledged fact that we perceive errors in the work of others more readily than in our own.,"anticipation,optimism,anger,sadness,disgust"
Anyone from anywhere can do anything.,"anticipation,optimism,joy"
Ever tried. Ever failed. No matter. Try again. Fail again. Fail better.,"optimism,sadness,anger,disgust,joy"
It would be an incredible adventure. And life needs to be more than just solving every day problems. You need to wake up and be excited about the future,"anticipation,sadness,anger,disgust,joy,optimism"
"I speak and speak, … but the listener retains only the words he is expecting. … It is not the voice that commands the story: it is the ear.","anticipation,optimism,joy"
"Children have never been very good at listening to their elders, but they have never failed to imitate them.","anticipation,anger,sadness,disgust,joy,optimism"
All the drugs in the world won't save us from ourselves.,"optimism,sadness,pessimism,joy"
To me justice doesn't mean looking for the criminals. It means looking for the innocent.,"optimism,anger,disgust"
The reflective teacher makes the learners decide for themselves and ensures that the decision is sound and reasonable. He or she asks a lot of questions for the learners to carry out self-assessment.,"trust,anticipation,optimism,love,joy"
"The real struggle is not between East and West, or capitalism and communism, but between education and propaganda.","fear,anger,sadness,disgust,joy,optimism,pessimism"
Play always as if in the presence of a master.,"anticipation,optimism,joy"
"I don’t think that everyone should become a mathematician, but I do believe that many students don’t give mathematics a real chance.","fear,anticipation,optimism,joy"
"I just wanna lay my head on your chest,
so I'm as close as it gets to your heart
We can fall apart, start over again","optimism,sadness,love,joy"
"Each time we don't say what we wanna say, we're dying.","pessimism,fear,sadness,disgust"
"The objective of education reform is to creat learning individual, organization, and society. An educated person or the authentic learning outcome should possess the following abilities and characteristics which are based on Thai cultural heritage and appropriate level of education: good physical and mental health, critical thinking, intellectual inquisitiveness, professionalism, sense of responsibility, honesty, selfsacrifice, perseverance, team spirit, adherence to democracy, and love for King, Country and Religion.","fear,anger,disgust,joy,trust,optimism,love"
"The heart of man is very much like the sea, it has its storms, it has its tides and in its depths it has its pearls too","anger,sadness,disgust,joy,optimism,love"
"When peace comes, we will perhaps in time be able to forgive the Arabs for killing our sons, but it will be harder for us to forgive them for having forced us to kill their sons.","anger,sadness,disgust,joy,optimism"
Sadness is almost never anything but a form of fatigue.,"sadness,pessimism,disgust"
"Learn to pay yourself first, you'll never be broke",optimism
"I didn't choose the thug life, the thug life chose me.",optimism
"It's not about the number of hours you practice, it's about the number of hours your mind is present during the practice.","anticipation,optimism,sadness,joy"
"Hey Constantinople! Either I take you, or you take me!",anticipation
"Can you imagine how terrible it is when you've got everything and you're still desperately lonely? That is awful beyond words.
I'm so powerful on stage that I seem to have created a monster. When I'm performing I'm an extrovert, yet inside I'm a completely different man.","fear,anger,sadness,anticipation,disgust,joy,optimism,pessimism"
The best way to know the soul of another country is to read its literature.,"anticipation,optimism,joy"
Follow your heart but take your brain with you.,"trust,optimism,love,sadness,joy"
