,Text,joy,optimism,love,trust,anticipation,surprise,sadness,anger,fear,pessimism,disgust
592,"Only once in your life, I truly believe, you find someone who can completely turn your world around. You tell them things that you’ve never shared with another soul and they absorb everything you say and actually want to hear more. You share hopes for the future, dreams that will never come true, goals that were never achieved and the many disappointments life has thrown at you. When something wonderful happens, you can’t wait to tell them about it, knowing they will share in your excitement. They are not embarrassed to cry with you when you are hurting or laugh with you when you make a fool of yourself. Never do they hurt your feelings or make you feel like you are not good enough, but rather they build you up and show you the things about yourself that make you special and even beautiful. There is never any pressure, jealousy or competition but only a quiet calmness when they are around. You can be yourself and not worry about what they will think of you because they love you for who you are. The things that seem insignificant to most people such as a note, song or walk become invaluable treasures kept safe in your heart to cherish forever. Memories of your childhood come back and are so clear and vivid it’s like being young again. Colours seem brighter and more brilliant. Laughter seems part of daily life where before it was infrequent or didn’t exist at all. A phone call or two during the day helps to get you through a long day’s work and always brings a smile to your face. In their presence, there’s no need for continuous conversation, but you find you’re quite content in just having them nearby. Things that never interested you before become fascinating because you know they are important to this person who is so special to you. You think of this person on every occasion and in everything you do. Simple things bring them to mind like a pale blue sky, gentle wind or even a storm cloud on the horizon. You open your heart knowing that there’s a chance it may be broken one day and in opening your heart, you experience a love and joy that you never dreamed possible. You find that being vulnerable is the only way to allow your heart to feel true pleasure that’s so real it scares you. You find strength in knowing you have a true friend and possibly a soul mate who will remain loyal to the end. Life seems completely different, exciting and worthwhile. Your only hope and security is in knowing that they are a part of your life.",0.8907856941223145,0.9690518379211426,0.48472005128860474,0.29465728998184204,0.06270478665828705,0.013944277539849281,0.25204983353614807,0.009595095179975033,0.08729711920022964,0.04892827942967415,0.011362142860889435
593,In my end is my beginning.,0.7191526293754578,0.9629547595977783,0.04988449066877365,0.26287510991096497,0.21192149817943573,0.013247882016003132,0.0305998045951128,0.025174260139465332,0.011801927350461483,0.020936211571097374,0.015122488141059875
594,Life will bring you pain all by itself. Your responsibility is to create joy.,0.3992060720920563,0.9694432616233826,0.05753471329808235,0.1821332573890686,0.07209119200706482,0.007543216459453106,0.3439505398273468,0.03711570054292679,0.0427764430642128,0.09391181915998459,0.033117447048425674
595,"Nobody knows me, nobody knows one thing about me Everyone doubts me But, I'ma make it all come true, and I do it for you I know all about the pain that you go through",0.28333476185798645,0.975482702255249,0.06661323457956314,0.35064536333084106,0.20517472922801971,0.012342143803834915,0.32361289858818054,0.018780682235956192,0.1256348341703415,0.1365301012992859,0.021351462230086327
596,"We come to love not by finding the perfect person, but by learning to see an imperfect person perfectly.",0.9787322878837585,0.9317787885665894,0.8296084403991699,0.2706921398639679,0.04684511944651604,0.02422874979674816,0.029478373005986214,0.01464911736547947,0.014870598912239075,0.01564924605190754,0.01109407376497984
597,Its hard to be a diamond in a rhinestone world.,0.15007910132408142,0.8165439367294312,0.017564840614795685,0.0767875537276268,0.2438078224658966,0.011657333001494408,0.5629904270172119,0.015808170661330223,0.0468871109187603,0.24199903011322021,0.03998417407274246
598,"If you make it, great. If you miss it - what's there to be afraid of?",0.35820314288139343,0.8588845133781433,0.04220166057348251,0.15982529520988464,0.19066576659679413,0.027798393741250038,0.030777055770158768,0.02273092046380043,0.9346449971199036,0.05477127432823181,0.02028455212712288
599,"A friend is one to whom one may pour out the contents of one's heart, chaff and grain together, knowing that gentle hands will take and sift it, keep what is worth keeping, and with a breath of kindness, blow the rest away.",0.9511949419975281,0.9719675779342651,0.30315256118774414,0.29908737540245056,0.08080891519784927,0.015261107124388218,0.02680307812988758,0.015169181860983372,0.011945762671530247,0.0141648193821311,0.009809933602809906
600,Better to die fighting for freedom then be a prisoner all the days of your life.,0.009418206289410591,0.08285991847515106,0.005137700121849775,0.012394648045301437,0.07150833308696747,0.009896022267639637,0.7207077741622925,0.2048608362674713,0.8224331140518188,0.46131598949432373,0.3543141782283783
601,Honesty is the first chapter of the book wisdom.,0.8338489532470703,0.9746701717376709,0.10814748704433441,0.4087631404399872,0.17777371406555176,0.01951592229306698,0.02171614021062851,0.020112210884690285,0.020424621179699898,0.016492893919348717,0.011730766855180264
602,"We don't like to kill our unborn, we need them to grow up and fight our wars.",0.015210890211164951,0.5321252942085266,0.007592035457491875,0.07380329072475433,0.17971982061862946,0.011373074725270271,0.17380471527576447,0.7435975074768066,0.30498096346855164,0.21967336535453796,0.5692933201789856
603,"It’s not possible, and nor should it be possible, to control what anyone thinks about you. Especially if it’s not based in any reality.",0.01445047277957201,0.40614429116249084,0.0042382474057376385,0.07108674943447113,0.37916305661201477,0.020240280777215958,0.14984031021595,0.5390327572822571,0.053909316658973694,0.20427542924880981,0.4241718053817749
604,There is nothing in this world that I fear to say.,0.1431553065776825,0.7681410908699036,0.036719486117362976,0.11469350755214691,0.109199158847332,0.01652717776596546,0.06521978229284286,0.02805323712527752,0.9556035399436951,0.09420640766620636,0.028268637135624886
605,"The learner has to realize that he or she is the one who sets the objective, the learning tasks and the stage for success.",0.7691272497177124,0.9704978466033936,0.06894285976886749,0.42098966240882874,0.353887677192688,0.025032928213477135,0.0205738116055727,0.018513431772589684,0.029562070965766907,0.019270697608590126,0.011902179569005966
606,"The gift of mental power comes from God, Divine Being, and if we concentrate our minds on that truth, we become in tune with this great power. My Mother had taught me to seek all truth in the Bible.",0.9153255224227905,0.9784746766090393,0.24358496069908142,0.4532421827316284,0.1279175579547882,0.021320967003703117,0.02200329862535,0.018787965178489685,0.020423797890543938,0.0159150380641222,0.011206998489797115
607,"If the citizens are wealthy, the country is strong. The King's storehouse is his people.",0.9055870771408081,0.9630568027496338,0.14043018221855164,0.3850192427635193,0.18435710668563843,0.02369162067770958,0.014444085769355297,0.024036338552832603,0.014605144970119,0.012026865035295486,0.012784902937710285
608,"Political language is designed to make lies sound truthful and murder respectable, and to give an appearance of solidity to pure wind.",0.11613406985998154,0.46095529198646545,0.004139195196330547,0.05108391493558884,0.46389061212539673,0.031104423105716705,0.057492971420288086,0.2814266085624695,0.010256110690534115,0.0573456697165966,0.2508748471736908
609,"in the swastika, the mission of the struggle for the victory of the Aryan man, and, by the same token, the victory of the idea of creative work.",0.804688036441803,0.9332114458084106,0.04322598874568939,0.23386503756046295,0.29876214265823364,0.019803985953330994,0.01894393563270569,0.026973679661750793,0.009068543091416359,0.014129471965134144,0.01573646068572998
610,"It is not heroes that make history, but history that makes heroes.",0.8873145580291748,0.9668350219726562,0.09512358158826828,0.27397122979164124,0.16634821891784668,0.01717352122068405,0.02148311398923397,0.017109965905547142,0.013121098279953003,0.014567263424396515,0.010761085897684097
611,I like roses best. But they bloom in all four seasons. I wonder if people who like roses best have to die four times over again.,0.3263149559497833,0.15579579770565033,0.045139361172914505,0.016920581459999084,0.061698440462350845,0.028729690238833427,0.8974052667617798,0.12250664085149765,0.07288949936628342,0.27485597133636475,0.32091981172561646
612,"Instead of buying your children all the things you never had, you should teach them all the things you were never taught. Material wears out but knowledge stays.",0.16189509630203247,0.9332752227783203,0.01278206892311573,0.2318437099456787,0.3741752505302429,0.014394046738743782,0.07288344204425812,0.04930904507637024,0.03376493975520134,0.07511549443006516,0.040666867047548294
613,Where does a thought go when it's forgotten?,0.036009449511766434,0.2581237852573395,0.005510143935680389,0.024494295939803123,0.32972201704978943,0.01854405179619789,0.6331520676612854,0.023330654948949814,0.14821873605251312,0.383518785238266,0.07966943085193634
614,Teachers also say that teaching for learning how-to-learn-learn will consume a lot of time. It will be difficult to cover all the content specified by the curriculum if learning uses up too much time on hands-on activities. The less-is-more alternative has not been considered as a possible solution at all in educational reforms where only expanding will bring about progress and development is more. Now is an appropriate time for educators to come down to the heart of educational matters or the learning methods to achieve the less-is-more alternative in all educational reforms.,0.05336224287748337,0.6722250580787659,0.006031038239598274,0.08293768018484116,0.480802983045578,0.01744738034904003,0.2553336024284363,0.052524957805871964,0.04655129835009575,0.2027023732662201,0.09794175624847412
615,Wanting to be someone else is a waste of who you are,0.010929514653980732,0.05265715345740318,0.003386235097423196,0.008350702933967113,0.04549827799201012,0.010107805021107197,0.7357593178749084,0.8726856708526611,0.03685950115323067,0.34804999828338623,0.8309855461120605
616,"I became insane, with long intervals of horrible sanity.",0.011345469392836094,0.016300475224852562,0.005882429424673319,0.006230208557099104,0.034239329397678375,0.018671775236725807,0.9281362891197205,0.26376044750213623,0.812588095664978,0.5265562534332275,0.4541698098182678
617,"I can’t win. Love is Russian roulette for me. No one loves the real me inside. they're all in love with my fame, my stardom.
I fall in love far too quickly and end up getting hurt all the time. I've got scars all over. But I can't help myself because basically I'm a softie I have this hard, macho shell — which I project on stage but there's a much softer side. too, which melts like butter.",0.7009093165397644,0.5652562379837036,0.4757833778858185,0.12069964408874512,0.042332008481025696,0.025589292868971825,0.9391491413116455,0.023864345625042915,0.03988219425082207,0.18487419188022614,0.05721320956945419
618,"If I can't do it, I will work on it until I can. If I become able to do it, I will work on it until I can do it perfectly. If I become able to do it perfectly, I will work on it until I can do it perfectly any number of times.",0.8314158320426941,0.9711450338363647,0.07347092777490616,0.4244866371154785,0.3413197696208954,0.025441253557801247,0.019818449392914772,0.026374580338597298,0.016304925084114075,0.017627982422709465,0.015126372687518597
619,"It is important to expect nothing, to take every experience, including the negative ones, as merely steps on the path, and to proceed.",0.2892153263092041,0.9706239700317383,0.024101244285702705,0.3363686203956604,0.2732292413711548,0.014321768656373024,0.05035504698753357,0.04568665102124214,0.05021822825074196,0.05007011815905571,0.02789582870900631
620,"I can't tell you how many directors have decided that Donna Anna wants to be raped by Don Giovanni and is in love with him, even though she has never seen him before.",0.8132087588310242,0.08720241487026215,0.13650855422019958,0.07498025894165039,0.6229813694953918,0.4548441469669342,0.16339129209518433,0.05730107054114342,0.15938962996006012,0.055290281772613525,0.13099947571754456
621,Do not take life too seriously – you will never get out of it alive.,0.07588514685630798,0.9362016320228577,0.01759091205894947,0.19509699940681458,0.23061181604862213,0.009759841486811638,0.2872209846973419,0.034320153295993805,0.19007916748523712,0.20926307141780853,0.03520330414175987
622,The learning must belong to the learners and not to the teachers.,0.15750709176063538,0.6874023079872131,0.012326640076935291,0.12673547863960266,0.403003066778183,0.01715456321835518,0.039300866425037384,0.05758608132600784,0.014603492803871632,0.038398489356040955,0.04728786274790764
623,"Words, how little they mean when you're a little too late.",0.04284486174583435,0.5477007627487183,0.004897315055131912,0.03927614912390709,0.24072246253490448,0.012121670879423618,0.4168173670768738,0.13952922821044922,0.0242246575653553,0.2714233994483948,0.17505893111228943
624,"Try to become not a man of success, but try rather to become a man of value.",0.37619850039482117,0.9471209049224854,0.019819462671875954,0.216002956032753,0.2904351055622101,0.012523431330919266,0.05331280454993248,0.03259347379207611,0.019065795466303825,0.039951957762241364,0.02496114745736122
625,"There are four questions of value in life… What is sacred? Of what is the spirit made? What is worth living ""for, and what is worth dying for? The answer to each is same. Only love.",0.9450212717056274,0.9635342359542847,0.6675840020179749,0.400587797164917,0.08252111822366714,0.017390504479408264,0.05078469216823578,0.012271073646843433,0.020258339121937752,0.02272268570959568,0.009510597214102745
626,"I speak my mind, because it hurts to bite my tongue",0.007929009385406971,0.14147187769412994,0.0024390858598053455,0.014748936519026756,0.10710351914167404,0.01042614784091711,0.5264851450920105,0.6012793183326721,0.3381171226501465,0.383650541305542,0.5890779495239258
627,"Because in the end, you won’t remember the time you spent working in the office or mowing your lawn. Climb that goddamn mountain.",0.0409742146730423,0.017649928107857704,0.005546147003769875,0.00603101821616292,0.03816628083586693,0.02094460278749466,0.385580450296402,0.9741326570510864,0.012910673394799232,0.08075663447380066,0.9428179860115051
628,"If a man knows more than others, he becomes lonely.",0.03808753937482834,0.25935572385787964,0.0167793370783329,0.028924155980348587,0.08827783167362213,0.010192849673330784,0.9420424103736877,0.027477623894810677,0.08659113943576813,0.5666542053222656,0.0782393366098404
629,The problem with the world is that the intelligent people are full of doubts while the stupid one are full of confidence.,0.009622486308217049,0.25018060207366943,0.002685623010620475,0.02534368261694908,0.2136533260345459,0.016393141821026802,0.5428866147994995,0.32710710167884827,0.12825912237167358,0.4737708270549774,0.4503697156906128
630,Don't judge people on who they used to be. Allow them to be who they are. See them «now». Not «then». ,0.16967348754405975,0.9309788346290588,0.015282217413187027,0.23003360629081726,0.3275647461414337,0.012202257290482521,0.060306839644908905,0.0752740129828453,0.02342025563120842,0.062574103474617,0.0478336364030838
631,"It isn't what we say or think that defines us, but what we do.",0.10795041173696518,0.9069848656654358,0.011181714944541454,0.21952837705612183,0.42431846261024475,0.017575180158019066,0.06466194242238998,0.07318850606679916,0.04521095007658005,0.07546984404325485,0.051950603723526
632,I never realized that a child is capable of remembering so well and of waiting so patiently,0.5039253830909729,0.713986337184906,0.030705079436302185,0.15558141469955444,0.7360526323318481,0.06682417541742325,0.05890525504946709,0.00974243227392435,0.041702307760715485,0.041862670332193375,0.018857348710298538
633,"At the very beginning, the crucial element to be considered for education reform is the management system. The administrative power, in particular, has to be shifted to local authorities, and local participation in the school management is essentially encouraged.",0.43851253390312195,0.8037451505661011,0.01787584088742733,0.23274607956409454,0.6730973124504089,0.045367952436208725,0.02356802299618721,0.04535851255059242,0.013418353162705898,0.026708699762821198,0.03656017780303955
634,"Hope is the thing with feathers
That perches in the soul
And sings the tune without the words
And never stops at all.",0.6932085156440735,0.9672247767448425,0.04827909544110298,0.20941607654094696,0.13771846890449524,0.009657557122409344,0.0411735363304615,0.023195771500468254,0.016646631062030792,0.023802829906344414,0.015447293408215046
635,People generally don't change unless a traumatic event occurs in their life which triggers the brain into new action.,0.05525793880224228,0.6879664659500122,0.012135823257267475,0.04981972649693489,0.16228950023651123,0.009151562117040157,0.7400048971176147,0.0215096864849329,0.1829516589641571,0.355416864156723,0.05126907676458359
636,"Correct."" Kekrops sounded bitter, like he regretted his decision. ""My people were the original Athenians--the gemini.""
""Like your zodiac sign?"" Percy asked. ""I'm a Leo.""
""No, stupid,"" Leo said. ""I'm a Leo. You're a Percy.",0.10519426316022873,0.0966261774301529,0.003493185853585601,0.008131470531225204,0.11158860474824905,0.02071569301187992,0.4119775593280792,0.6069342494010925,0.0059093935415148735,0.12623731791973114,0.6038084626197815
637,It's too bad that stupidity isn't painful.,0.04772185906767845,0.1748465597629547,0.006839452311396599,0.012991751544177532,0.045235756784677505,0.010839344933629036,0.8553887009620667,0.5937897562980652,0.010030223056674004,0.3556845486164093,0.5464829206466675
638,Blind belief in authority is the greatest enemy of truth.,0.023296300321817398,0.8174402713775635,0.007101177703589201,0.15204958617687225,0.30883726477622986,0.010935481637716293,0.13447867333889008,0.14367735385894775,0.19447408616542816,0.1937040388584137,0.11272012442350388
639,The beauty of mathematics only shows itself to more patient followers.,0.9277560710906982,0.9725684523582458,0.14177443087100983,0.3521197438240051,0.17101754248142242,0.022112036123871803,0.016295596957206726,0.018553825095295906,0.014637015759944916,0.012617598287761211,0.010493284091353416
640,Darkness cannot drive out darkness: only light can do that. Hate cannot drive out hate: only love can do that.,0.1066066324710846,0.9289962649345398,0.03750666603446007,0.2955045700073242,0.11512649059295654,0.010815427638590336,0.10814952850341797,0.6589879393577576,0.06736374646425247,0.08806638419628143,0.22251339256763458
641,I tell my piano the things I used to tell you,0.6506944298744202,0.7892909646034241,0.06675439327955246,0.10705741494894028,0.29050859808921814,0.01715640351176262,0.30755871534347534,0.006781049072742462,0.012718534097075462,0.06031295284628868,0.016687966883182526
642,"Whenever you get there, there is no there there.",0.030369803309440613,0.32962486147880554,0.007401587907224894,0.025662168860435486,0.14740803837776184,0.008669905364513397,0.7828737497329712,0.050720714032649994,0.06315300613641739,0.4582628011703491,0.12269218266010284
643,"If I had a flower for every time I thought of you, I could walk through my garden forever.",0.9749884009361267,0.9150249361991882,0.4958406984806061,0.23454418778419495,0.1945812702178955,0.028162142261862755,0.05163906142115593,0.004221238195896149,0.01951334998011589,0.016193054616451263,0.006027894094586372
644,Never be afraid to trust an unknown future to a known God.,0.5379903316497803,0.9792293310165405,0.10024875402450562,0.4609832465648651,0.17488938570022583,0.023636648431420326,0.03366072103381157,0.022633343935012817,0.5305238962173462,0.041698019951581955,0.014527295716106892
645,"This is what the past is for! Every experience God gives us, every person He puts in our lives is the perfect preparation for the future that only He can see.",0.9279900789260864,0.9817569851875305,0.25437384843826294,0.45312902331352234,0.13225558400154114,0.021744655445218086,0.02092786692082882,0.017402511090040207,0.023675138130784035,0.015994610264897346,0.01017669215798378
646,"I think that truth is the highest value, although it has to be embedded in love. What I mean by that is that truth should serve the highest good imaginable. For me, that is what is best for each individual, in the manner that is simultaneously best for the family, and the state, and nature itself. But you can only want that good if you love Being.",0.9663556814193726,0.9716710448265076,0.4788776934146881,0.37045761942863464,0.08914449065923691,0.020646240562200546,0.020942172035574913,0.014808994717895985,0.014793425798416138,0.013476540334522724,0.009378430433571339
647,"There is a magnet in your heart that will attract true friends. That magnet is unselfishness, thinking of others first; when you learn to live for others, they will live for you.",0.7282686829566956,0.9829189777374268,0.09456469118595123,0.4604185223579407,0.21171563863754272,0.01702277734875679,0.038386113941669464,0.01937936805188656,0.03453109413385391,0.026906609535217285,0.012712055817246437
648,"Time is still the best critic, and patience the best teacher.",0.8627098798751831,0.9791639447212219,0.09770169109106064,0.3555280268192291,0.16217860579490662,0.016852837055921555,0.02380400151014328,0.01958939991891384,0.02112411893904209,0.0168137326836586,0.011671747080981731
649,"Why not just tell people I'm an alien from Mars. Tell them I eat live chickens and do a voodoo dance at midnight. They'll believe anything you say, because you're a reporter. But if I, Michael Jackson, were to say, ""I'm an alien from Mars and I eat live chickens and do a voodoo dance at midnight,"" people would say, ""Oh, man, that Michael Jackson is nuts. He's cracked up. You can't believe a damn word that comes out of his mouth.""",0.8237955570220947,0.2099052518606186,0.036398470401763916,0.045056574046611786,0.2055426836013794,0.21361090242862701,0.020437020808458328,0.7525994777679443,0.005484054796397686,0.013500015251338482,0.5353593230247498
650,A TV evening with the right person can be more erotic than sex with the wrong one. ,0.9275912046432495,0.347051203250885,0.07275144755840302,0.08978646993637085,0.5897952318191528,0.1501382440328598,0.024744946509599686,0.018908968195319176,0.00753630930557847,0.012601551599800587,0.027727192267775536
651,"Why do two colors, put one next to the other, sing? Can one really explain this? no. Just as one can never learn how to paint.",0.07554222643375397,0.03326001763343811,0.010708499699831009,0.03245110437273979,0.5457199811935425,0.22665439546108246,0.146394282579422,0.12466486543416977,0.02252916246652603,0.07415168732404709,0.25128573179244995
652,"When you have money in hand, only you forget who are you. But when you do not have any money in your hand, the whole world forget who you are. It's life.",0.11476440727710724,0.6955013871192932,0.017758242785930634,0.05279507115483284,0.15713955461978912,0.010695124976336956,0.8001368045806885,0.019158020615577698,0.06324531137943268,0.33814990520477295,0.04790199175477028
653,"If you see me in a fight with a bear, pray for the bear.",0.0774347186088562,0.5608826875686646,0.005436387378722429,0.0687260702252388,0.3840997517108917,0.016512511298060417,0.026717528700828552,0.11306823045015335,0.18697017431259155,0.041864946484565735,0.07357148826122284
654,"Only the weak will fall and give up, the strong falls 100 times and wakes up 200 times",0.1276632398366928,0.9489582777023315,0.014982216991484165,0.21072639524936676,0.2056034654378891,0.009046663530170918,0.11802729964256287,0.07630711793899536,0.04863741621375084,0.10711634904146194,0.048720136284828186
655,"When there's a person, there's a problem. When there's no person, there's no problem.",0.11041683703660965,0.9560755491256714,0.017017975449562073,0.21492750942707062,0.19010837376117706,0.0086144357919693,0.1757032871246338,0.10553213953971863,0.04967188090085983,0.12432410567998886,0.06984506547451019
656,"Looking back on each element, the absence of the audience this time meant that it was difficult to make that connection [with the crowd], but there are a lot of movements in the choreography that try to speak to the audience, so I think that’s also a key appeal for this program.",0.1809217780828476,0.3608662188053131,0.010040237568318844,0.08969143778085709,0.8095119595527649,0.0818437933921814,0.12283594161272049,0.01700843870639801,0.08848782628774643,0.0949966087937355,0.04683364927768707
657,Truly free people do not need to be told they are free.,0.5278269052505493,0.9637694954872131,0.03596615046262741,0.3319697082042694,0.24992164969444275,0.01405153889209032,0.03227575868368149,0.042255058884620667,0.017543097957968712,0.027262955904006958,0.02354349195957184
